ticker,name,market,locale,primary_exchange,type,active,currency_name,cik,last_updated_utc
CVBF,CVB Financial Corp,stocks,us,XNAS,CS,True,usd,0000354647,2025-09-15T06:04:58.615020444Z
CVCO,Cavco Industries Inc.,stocks,us,XNAS,CS,True,usd,0000278166,2025-09-15T06:04:58.615020524Z
CVE,Cenovus Energy Inc.,stocks,us,XNYS,CS,True,usd,0001475260,2025-09-15T06:04:58.615020604Z
CVE.WS,Cenovus Energy Inc. Warrants (each warrant entitles the holder to purchase one common share at an exercise price of C$6.54 per share),stocks,us,XNYS,WARRANT,True,usd,0001475260,2025-09-15T06:04:58.615020684Z
CVEO,Civeo Corporation,stocks,us,XNYS,CS,True,usd,0001590584,2025-09-15T06:04:58.615020765Z
CVGI,"Commercial Vehicle Group, Inc.",stocks,us,XNAS,CS,True,usd,0001290900,2025-09-15T06:04:58.615020845Z
CVGW,Calavo Growers Inc,stocks,us,XNAS,CS,True,usd,0001133470,2025-09-15T06:04:58.615020925Z
CVI,"CVR ENERGY, INC.",stocks,us,XNYS,CS,True,usd,0001376139,2025-09-15T06:04:58.615021005Z
CVIE,Calvert International Responsible Index ETF,stocks,us,ARCX,ETF,True,usd,,2025-09-15T06:04:58.615021376Z
CVKD,"Cadrenal Therapeutics, Inc. Common Stock",stocks,us,XNAS,CS,True,usd,0001937993,2025-09-15T06:04:58.615021466Z
CVLC,Calvert US Large-Cap Core Responsible Index ETF,stocks,us,ARCX,ETF,True,usd,,2025-09-15T06:04:58.615021566Z
CVLG,"Covenant Logistics Group, Inc.",stocks,us,XNYS,CS,True,usd,0000928658,2025-09-15T06:04:58.615021646Z
CVLT,"Commault Systems, Inc.",stocks,us,XNAS,CS,True,usd,0001169561,2025-09-15T06:04:58.615021736Z
CVM,Cel-Sci Corporation,stocks,us,XASE,CS,True,usd,0000725363,2025-09-15T06:04:58.615021817Z
CVMC,Calvert US Mid-Cap Core Responsible Index ETF,stocks,us,ARCX,ETF,True,usd,,2025-09-15T06:04:58.615021897Z
CVNA,Carvana Co.,stocks,us,XNYS,CS,True,usd,0001690820,2025-09-15T06:04:58.615021977Z
CVNX,Defiance Daily Target 2X Long CVNA ETF,stocks,us,XNAS,ETF,True,usd,,2025-09-15T06:04:58.615022057Z
CVNY,YieldMax CVNA Option Income Strategy ETF,stocks,us,ARCX,ETS,True,usd,,2025-09-15T06:04:58.615022137Z
CVR,Chicago Rivet & Machine Co.,stocks,us,XASE,CS,True,usd,0000019871,2025-09-15T06:04:58.615022227Z
CVRD,Madison Covered Call ETF,stocks,us,ARCX,ETF,True,usd,,2025-09-15T06:04:58.615022308Z
CVRT,Calamos Convertible Equity Alternative ETF,stocks,us,ARCX,ETF,True,usd,0001579881,2025-09-15T06:04:58.615022388Z
CVRX,"CVRx, Inc. Common Stock",stocks,us,XNAS,CS,True,usd,0001235912,2025-09-15T06:04:58.615022468Z
CVS,CVS HEALTH CORPORATION,stocks,us,XNYS,CS,True,usd,0000064803,2025-09-15T06:04:58.615022548Z
CVSB,Calvert Ultra-Short Investment Grade ETF,stocks,us,ARCX,ETF,True,usd,,2025-09-15T06:04:58.615022628Z
CVSE,Calvert US Select Equity ETF,stocks,us,ARCX,ETF,True,usd,,2025-09-15T06:04:58.615022869Z
CVU,"CPI Aerostructures, Inc.",stocks,us,XASE,CS,True,usd,0000889348,2025-09-15T06:04:58.615022949Z
CVV,CVD Equipment Corp.,stocks,us,XNAS,CS,True,usd,0000766792,2025-09-15T06:04:58.615023069Z
CVX,Chevron Corporation,stocks,us,XNYS,CS,True,usd,0000093410,2025-09-15T06:04:58.615023149Z
CVY,Invesco Zacks Multi-Asset Income ETF,stocks,us,ARCX,ETF,True,usd,0001209466,2025-09-15T06:04:58.615023229Z
CW,Curtiss-Wright Corp.,stocks,us,XNYS,CS,True,usd,0000026324,2025-09-15T06:04:58.615023309Z
CWAN,"Clearwater Analytics Holdings, Inc.",stocks,us,XNYS,CS,True,usd,0001866368,2025-09-15T06:04:58.61502339Z
CWB,SPDR Bloomberg Convertible Securities ETF,stocks,us,ARCX,ETF,True,usd,0001064642,2025-09-15T06:04:58.61502347Z
CWBC,Community West Bancshares Common Stock,stocks,us,XNAS,CS,True,usd,0001127371,2025-09-15T06:04:58.61502355Z
CWCO,Consolidated Water Co Inc,stocks,us,XNAS,CS,True,usd,0000928340,2025-09-15T06:04:58.61502365Z
CWD,CaliberCos Inc. Class A Common Stock,stocks,us,XNAS,CS,True,usd,0001627282,2025-09-15T06:04:58.61502373Z
CWEB,Direxion Daily CSI China Internet Index Bull 2X Shares,stocks,us,ARCX,ETF,True,usd,0001424958,2025-09-15T06:04:58.61502381Z
CWEN,"Clearway Energy, Inc. Class C Common Stock",stocks,us,XNYS,CS,True,usd,0001567683,2025-09-15T06:04:58.615023891Z
CWEN.A,"Clearway Energy, Inc.  Class A Common Stock",stocks,us,XNYS,CS,True,usd,0001567683,2025-09-15T06:04:58.615023971Z
CWH,"Camping World Holdings, Inc.",stocks,us,XNYS,CS,True,usd,0001669779,2025-09-15T06:04:58.615024051Z
CWI,SPDR MSCI ACWI ex-US ETF,stocks,us,ARCX,ETF,True,usd,0001168164,2025-09-15T06:04:58.615024141Z
CWK,Cushman & Wakefield plc Ordinary Shares,stocks,us,XNYS,CS,True,usd,0001628369,2025-09-15T06:04:58.615024351Z
CWS,AdvisorShares Focused Equity ETF,stocks,us,ARCX,ETF,True,usd,0001408970,2025-09-15T06:04:58.615024442Z
CWST,Casella Waste Systems Inc,stocks,us,XNAS,CS,True,usd,0000911177,2025-09-15T06:04:58.615024572Z
CWT,California Water Service,stocks,us,XNYS,CS,True,usd,0001035201,2025-09-15T06:04:58.615024652Z
CWVX,Tradr 2X Long CRWV Daily ETF,stocks,us,BATS,ETF,True,usd,,2025-09-15T06:04:58.615024732Z
CX,Cemex S.A.B. de C.V.,stocks,us,XNYS,ADRC,True,usd,0001076378,2025-09-15T06:04:58.615024812Z
CXAI,CXApp Inc. Class A Common Stock,stocks,us,XNAS,CS,True,usd,0001820875,2025-09-15T06:04:58.615024892Z
CXAIW,CXApp Inc. Warrant,stocks,us,XNAS,WARRANT,True,usd,0001820875,2025-09-15T06:04:58.615024973Z
CXDO,CREXENDO INC,stocks,us,XNAS,CS,True,usd,0001075736,2025-09-15T06:04:58.615025053Z
CXE,MFS High Income Municipal Trust,stocks,us,XNYS,FUND,True,usd,0000845606,2025-09-15T06:04:58.615025143Z
CXH,MFS Investment Grade Municipal Trust,stocks,us,XNYS,FUND,True,usd,0000847411,2025-09-15T06:04:58.615025223Z
CXM,"Sprinklr, Inc.",stocks,us,XNYS,CS,True,usd,0001569345,2025-09-15T06:04:58.615025303Z
CXRN,Teucrium 2x Daily Corn ETF,stocks,us,ARCX,ETF,True,usd,0001683471,2025-09-15T06:04:58.615025383Z
CXSE,WisdomTree Trust WisdomTree China ex-State-Owned Enterprises Fund,stocks,us,XNAS,ETF,True,usd,0001350487,2025-09-15T06:04:58.615025464Z
CXT,"Crane NXT, Co.",stocks,us,XNYS,CS,True,usd,0000025445,2025-09-15T06:04:58.615025544Z
CXW,"CoreCivic, Inc.",stocks,us,XNYS,CS,True,usd,0001070985,2025-09-15T06:04:58.615025624Z
CYBN,Cybin Inc.,stocks,us,XASE,CS,True,usd,0001833141,2025-09-15T06:04:58.615025864Z
CYBR,CyberArk Software Ltd.,stocks,us,XNAS,CS,True,usd,0001598110,2025-09-15T06:04:58.615025945Z
CYCN,"Cyclerion Therapeutics, Inc. Common Stock",stocks,us,XNAS,CS,True,usd,0001755237,2025-09-15T06:04:58.615026085Z
CYCU,"Cycurion, Inc. Common Stock",stocks,us,XNAS,CS,True,usd,0001868419,2025-09-15T06:04:58.615026165Z
CYCUW,"Cycurion, Inc. Warrant",stocks,us,XNAS,WARRANT,True,usd,0001868419,2025-09-15T06:04:58.615026245Z
CYD,China Yuchai International Ltd.,stocks,us,XNYS,CS,True,usd,0000932695,2025-09-15T06:04:58.615026335Z
CYH,"Community Health Systems, Inc.",stocks,us,XNYS,CS,True,usd,0001108109,2025-09-15T06:04:58.615026415Z
CYN,Cyngn Inc. Common Stock,stocks,us,XNAS,CS,True,usd,0001874097,2025-09-15T06:04:58.615026496Z
CYRX,"CryoPort, Inc. Common Stock",stocks,us,XNAS,CS,True,usd,0001124524,2025-09-15T06:04:58.615026576Z
CYTK,Cytokinetics Inc.,stocks,us,XNAS,CS,True,usd,0001061983,2025-09-15T06:04:58.615026656Z
CZA,Invesco Zacks Mid-Cap ETF,stocks,us,ARCX,ETF,True,usd,0001209466,2025-09-15T06:04:58.615026736Z
CZAR,Themes Natural Monopoly ETF,stocks,us,XNAS,ETF,True,usd,0001976322,2025-09-15T06:04:58.615026816Z
CZFS,"Citizens Financial Services, Inc. Common Stock",stocks,us,XNAS,CS,True,usd,0000739421,2025-09-15T06:04:58.615026896Z
CZNC,Citizens & Northern Corporation,stocks,us,XNAS,CS,True,usd,0000810958,2025-09-15T06:04:58.615026986Z
CZR,"Caesars Entertainment, Inc. Common Stock",stocks,us,XNAS,CS,True,usd,0001590895,2025-09-15T06:04:58.615027077Z
CZWI,"Citizens Community Bancorp, Inc.",stocks,us,XNAS,CS,True,usd,0001367859,2025-09-15T06:04:58.615027167Z
CpN,Citigroup Capital XIII 7.875% Fixed Rate/Floating Rate Trust Preferred Securities,stocks,us,XNYS,PFD,True,usd,0000831001,2025-09-15T06:04:58.615027417Z
D,"Dominion Energy, Inc Common Stock",stocks,us,XNYS,CS,True,usd,0000715957,2025-09-15T06:04:58.615027497Z
DAAQ,Digital Asset Acquisition Corp. Class A Ordinary shares,stocks,us,XNAS,CS,True,usd,0002052162,2025-09-15T06:04:58.615027618Z
DAAQU,Digital Asset Acquisition Corp. Units,stocks,us,XNAS,UNIT,True,usd,0002052162,2025-09-15T06:04:58.615027698Z
DAAQW,Digital Asset Acquisition Corp. Warrant,stocks,us,XNAS,WARRANT,True,usd,0002052162,2025-09-15T06:04:58.615027778Z
DABS,DoubleLine Asset-Backed Securities ETF,stocks,us,ARCX,ETF,True,usd,0001886172,2025-09-15T06:04:58.615028219Z
DAC,Danaos Corporation,stocks,us,XNYS,CS,True,usd,0001369241,2025-09-15T06:04:58.615028309Z
DADS,Digital Asset Debt Strategy ETF,stocks,us,XNAS,ETF,True,usd,0001387131,2025-09-15T06:04:58.615028399Z
DAIC,"CID HoldCo, Inc. Common Stock",stocks,us,XNAS,CS,True,usd,0002033770,2025-09-15T06:04:58.615028489Z
DAICW,"CID HoldCo, Inc. Warrants",stocks,us,XNAS,WARRANT,True,usd,0002033770,2025-09-15T06:04:58.61502857Z
DAIO,Data I/O Corp,stocks,us,XNAS,CS,True,usd,0000351998,2025-09-15T06:04:58.61502865Z
DAK,Dakota Active Equity ETF,stocks,us,XNAS,ETF,True,usd,,2025-09-15T06:04:58.61502873Z
DAKT,Daktronics Inc,stocks,us,XNAS,CS,True,usd,0000915779,2025-09-15T06:04:58.61502881Z
DAL,"Delta Air Lines, Inc.",stocks,us,XNYS,CS,True,usd,0000027904,2025-09-15T06:04:58.61502889Z
DALI,First Trust Exchange-Traded Fund VI First Trust Dorsey Wright DALI Equity ETF,stocks,us,XNAS,ETF,True,usd,0001552740,2025-09-15T06:04:58.61502898Z
DALN,DallasNews Corporation Series A Common Stock,stocks,us,XNAS,CS,True,usd,0001413898,2025-09-15T06:04:58.61502906Z
DAN,Dana Incorporated,stocks,us,XNYS,CS,True,usd,0000026780,2025-09-15T06:04:58.615029141Z
DAO,"Youdao, Inc. American Depositary Shares, each representing one Class A Ordinary Share",stocks,us,XNYS,ADRC,True,usd,0001781753,2025-09-15T06:04:58.615029221Z
DAPP,VanEck Digital Transformation ETF,stocks,us,XNAS,ETF,True,usd,0001137360,2025-09-15T06:04:58.615029301Z
DAPR,FT Vest U.S. Equity Deep Buffer ETF - April,stocks,us,BATS,ETF,True,usd,0001667919,2025-09-15T06:04:58.615029381Z
DAR,DARLING INGREDIENTS INC.,stocks,us,XNYS,CS,True,usd,0000916540,2025-09-15T06:04:58.615029461Z
DARE,"Dare Bioscience, Inc. Common Stock",stocks,us,XNAS,CS,True,usd,0001401914,2025-09-15T06:04:58.615029541Z
DARP,Grizzle Growth ETF,stocks,us,ARCX,ETF,True,usd,0001924868,2025-09-15T06:04:58.615029632Z
DASH,"DoorDash, Inc. Class A Common Stock",stocks,us,XNAS,CS,True,usd,0001792789,2025-09-15T06:04:58.615029712Z
DAT,ProShares Big Data Refiners ETF,stocks,us,ARCX,ETF,True,usd,0001174610,2025-09-15T06:04:58.615029802Z
DAUG,FT Vest U.S. Equity Deep Buffer ETF - August,stocks,us,BATS,ETF,True,usd,0001667919,2025-09-15T06:04:58.615029882Z
DAVA,Endava plc American Depositary Shares (each representing one Class A Ordinary Share),stocks,us,XNYS,ADRC,True,usd,0001656081,2025-09-15T06:04:58.615029962Z
DAVE,Dave Inc. Class A Common Stock,stocks,us,XNAS,CS,True,usd,0001841408,2025-09-15T06:04:58.615030042Z
DAVEW,Dave Inc. Warrants,stocks,us,XNAS,WARRANT,True,usd,0001841408,2025-09-15T06:04:58.615030122Z
DAWN,"Day One Biopharmaceuticals, Inc. Common Stock",stocks,us,XNAS,CS,True,usd,0001845337,2025-09-15T06:04:58.615030203Z
DAX,Global X Funds Global X DAX Germany ETF,stocks,us,XNAS,ETF,True,usd,0001432353,2025-09-15T06:04:58.615030283Z
DAY,"Dayforce, Inc.",stocks,us,XNYS,CS,True,usd,0001725057,2025-09-15T06:04:58.615030363Z
DB,Deutsche Bank Aktiengesellschaft,stocks,us,XNYS,CS,True,usd,0001159508,2025-09-15T06:04:58.615030453Z
DBA,Invesco DB Agriculture Fund,stocks,us,ARCX,ETV,True,usd,0001383082,2025-09-15T06:04:58.615030533Z
DBAW,Xtrackers MSCI All World ex US Hedged Equity ETF,stocks,us,ARCX,ETF,True,usd,0001503123,2025-09-15T06:04:58.615030613Z
DBB,Invesco DB Base Metals Fund,stocks,us,ARCX,ETV,True,usd,0001383084,2025-09-15T06:04:58.615030694Z
DBC,Invesco DB Commodity Index Tracking Fund,stocks,us,ARCX,ETV,True,usd,0001328237,2025-09-15T06:04:58.615030774Z
DBD,"Diebold Nixdorf, Incorporated",stocks,us,XNYS,CS,True,usd,0000028823,2025-09-15T06:04:58.615030854Z
DBE,Invesco DB Energy Fund,stocks,us,ARCX,ETV,True,usd,0001383062,2025-09-15T06:04:58.615030944Z
DBEF,Xtrackers MSCI EAFE Hedged Equity ETF,stocks,us,ARCX,ETF,True,usd,0001503123,2025-09-15T06:04:58.615031024Z
DBEM,Xtrackers MSCI Emerging Markets Hedged Equity ETF,stocks,us,ARCX,ETF,True,usd,0001503123,2025-09-15T06:04:58.615031104Z
DBEU,Xtrackers MSCI Europe Hedged Equity ETF,stocks,us,ARCX,ETF,True,usd,0001503123,2025-09-15T06:04:58.615031184Z
DBEZ,Xtrackers MSCI Eurozone Hedged Equity ETF,stocks,us,ARCX,ETF,True,usd,0001503123,2025-09-15T06:04:58.615031275Z
DBGI,"Digital Brands Group, Inc. Common Stock",stocks,us,XNAS,CS,True,usd,0001668010,2025-09-15T06:04:58.615031355Z
DBI,Designer Brands Inc.,stocks,us,XNYS,CS,True,usd,0001319947,2025-09-15T06:04:58.615031435Z
DBJP,Xtrackers MSCI Japan Hedged Equity ETF,stocks,us,ARCX,ETF,True,usd,0001503123,2025-09-15T06:04:58.615031515Z
DBL,DOUBLELINE OPPORTUNISTIC CREDIT FUND,stocks,us,XNYS,FUND,True,usd,0001525201,2025-09-15T06:04:58.615031595Z
DBMF,iMGP DBi Managed Futures Strategy ETF,stocks,us,ARCX,ETF,True,usd,0001020425,2025-09-15T06:04:58.615031675Z
DBND,DoubleLine Opportunistic Core Bond ETF,stocks,us,ARCX,ETF,True,usd,0001886172,2025-09-15T06:04:58.615031776Z
DBO,Invesco DB Oil Fund,stocks,us,ARCX,ETV,True,usd,0001383058,2025-09-15T06:04:58.615031856Z
DBP,Invesco DB Precious Metals Fund,stocks,us,ARCX,ETV,True,usd,0001383057,2025-09-15T06:04:58.615031936Z
DBRG,"DigitalBridge Group, Inc.",stocks,us,XNYS,CS,True,usd,0001679688,2025-09-15T06:04:58.615032016Z
DBRGpH,"DigitalBridge Group, Inc. 7.125% Series H Cumulative Redeemable Perpetual Preferred Stock",stocks,us,XNYS,PFD,True,usd,0001679688,2025-09-15T06:04:58.615032096Z
DBRGpI,"DigitalBridge Group, Inc. 7.15% Series I Cumulative Redeemable Perpetual Preferred Stock",stocks,us,XNYS,PFD,True,usd,0001679688,2025-09-15T06:04:58.615032186Z
DBRGpJ,"DigitalBridge Group, Inc. 7.125% Series J Cumulative Redeemable Perpetual Preferred Stock",stocks,us,XNYS,PFD,True,usd,0001679688,2025-09-15T06:04:58.615032267Z
DBVT,DBV Technologies S.A.,stocks,us,XNAS,CS,True,usd,0001613780,2025-09-15T06:04:58.615032347Z
DBX,"Dropbox, Inc. Class A",stocks,us,XNAS,CS,True,usd,0001467623,2025-09-15T06:04:58.615032427Z
DC,Dakota Gold Corp.,stocks,us,XASE,CS,True,usd,0001852353,2025-09-15T06:04:58.615032507Z
DC.WS,"Dakota Gold Corp. Warrants, each warrant exercisable for one Common Share at an exercise price of $2.08",stocks,us,XASE,WARRANT,True,usd,0001852353,2025-09-15T06:04:58.615032597Z
DCBO,Docebo Inc. Common Shares,stocks,us,XNAS,CS,True,usd,0001829959,2025-09-15T06:04:58.615032677Z
DCGO,DocGo Inc. Common Stock,stocks,us,XNAS,CS,True,usd,0001822359,2025-09-15T06:04:58.615032768Z
DCI,"Donaldson Company, Inc.",stocks,us,XNYS,CS,True,usd,0000029644,2025-09-15T06:04:58.615032848Z
DCMT,DoubleLine Commodity Strategy ETF,stocks,us,ARCX,ETF,True,usd,0001886172,2025-09-15T06:04:58.615032928Z
DCO,Ducommun Incorporated,stocks,us,XNYS,CS,True,usd,0000030305,2025-09-15T06:04:58.615033008Z
DCOM,"Dime Community Bancshares, Inc. Common Stock",stocks,us,XNAS,CS,True,usd,0000846617,2025-09-15T06:04:58.615033098Z
DCOMG,"Dime Community Bancshares, Inc. 9.000% Fixed-to-Floating Rate Subordinated Notes due 2034",stocks,us,XNAS,CS,True,usd,0000846617,2025-09-15T06:04:58.615033178Z
DCOMP,"Dime Community Bancshares, Inc. Fixed-Rate Non-Cumulative Perpetual Preferred Stock, Series A",stocks,us,XNAS,PFD,True,usd,0000846617,2025-09-15T06:04:58.615033258Z
DCOR,Dimensional US Core Equity 1 ETF,stocks,us,ARCX,ETF,True,usd,0001816125,2025-09-15T06:04:58.615033339Z
DCRE,DoubleLine Commercial Real Estate ETF,stocks,us,ARCX,ETF,True,usd,0001886172,2025-09-15T06:04:58.615033419Z
DCTH,Delcath Systems Inc,stocks,us,XNAS,CS,True,usd,0000872912,2025-09-15T06:04:58.615033499Z
DD,"DuPont de Nemours, Inc. Common Stock",stocks,us,XNYS,CS,True,usd,0001666700,2025-09-15T06:04:58.615033579Z
DDC,DDC Enterprise Limited,stocks,us,XASE,CS,True,usd,0001808110,2025-09-15T06:04:58.615033659Z
DDD,3D Systems Corporation,stocks,us,XNYS,CS,True,usd,0000910638,2025-09-15T06:04:58.615033749Z
DDEC,FT Vest U.S. Equity Deep Buffer ETF - December,stocks,us,BATS,ETF,True,usd,0001667919,2025-09-15T06:04:58.61503383Z
DDFL,Innovator Equity Dual Directional 15 Buffer ETF - July,stocks,us,BATS,ETF,True,usd,0001415726,2025-09-15T06:04:58.61503391Z
DDFS,Innovator Equity Dual Directional 15 Buffer ETF - September,stocks,us,BATS,ETF,True,usd,0001415726,2025-09-15T06:04:58.61503399Z
DDI,"DoubleDown Interactive Co., Ltd. American Depository Shares",stocks,us,XNAS,ADRC,True,usd,0001799567,2025-09-15T06:04:58.61503408Z
DDIV,First Trust Exchange-Traded Fund VI First Trust Dorsey Wright Momentum & Dividend ETF,stocks,us,XNAS,ETF,True,usd,0001552740,2025-09-15T06:04:58.61503416Z
DDL,Dingdong (Cayman) Limited American Depositary Shares (each two representing three Ordinary Shares),stocks,us,XNYS,ADRC,True,usd,0001854545,2025-09-15T06:04:58.61503425Z
DDLS,WisdomTree Dynamic International SmallCap Equity Fund,stocks,us,BATS,ETF,True,usd,0001350487,2025-09-15T06:04:58.615034331Z
DDM,ProShares Ultra Dow30,stocks,us,ARCX,ETF,True,usd,0001174610,2025-09-15T06:04:58.615034531Z
DDOG,"Datadog, Inc. Class A Common Stock",stocks,us,XNAS,CS,True,usd,0001561550,2025-09-15T06:04:58.615034611Z
DDS,Dillards Inc.,stocks,us,XNYS,CS,True,usd,0000028917,2025-09-15T06:04:58.615034721Z
DDT,Dillard's Capital Trust I 7.50% Capital Securities,stocks,us,XNYS,SP,True,usd,0000028917,2025-09-15T06:04:58.615034801Z
DDTL,Innovator Equity Dual Directional 10 Buffer ETF - July,stocks,us,BATS,ETF,True,usd,0001415726,2025-09-15T06:04:58.615034882Z
DDTS,Innovator Equity Dual Directional 10 Buffer ETF - September,stocks,us,BATS,ETF,True,usd,0001415726,2025-09-15T06:04:58.615034962Z
DDWM,WisdomTree Dynamic International Equity Fund,stocks,us,BATS,ETF,True,usd,0001350487,2025-09-15T06:04:58.615035072Z
DE,Deere & Company,stocks,us,XNYS,CS,True,usd,0000315189,2025-09-15T06:04:58.615035152Z
DEA,"Easterly Government Properties, Inc.",stocks,us,XNYS,CS,True,usd,0001622194,2025-09-15T06:04:58.615035232Z
DEC,Diversified Energy Company plc,stocks,us,XNYS,CS,True,usd,0001922446,2025-09-15T06:04:58.615035312Z
DECK,Deckers Outdoor Corp,stocks,us,XNYS,CS,True,usd,0000910521,2025-09-15T06:04:58.615035393Z
DECM,FT Vest U.S. Equity Max Buffer ETF - December,stocks,us,BATS,ETF,True,usd,0001667919,2025-09-15T06:04:58.615035503Z
DECO,SPDR Galaxy Digital Asset Ecosystem ETF,stocks,us,XNAS,ETF,True,usd,0001516212,2025-09-15T06:04:58.615035593Z
DECP,PGIM S&P 500 Buffer 12 ETF - December,stocks,us,BATS,ETF,True,usd,,2025-09-15T06:04:58.615035673Z
DECT,AllianzIM U.S. Large Cap Buffer10 Dec ETF,stocks,us,ARCX,ETS,True,usd,0001797318,2025-09-15T06:04:58.615035753Z
DECU,AllianzIM U.S. Equity Buffer15 Uncapped Dec ETF,stocks,us,BATS,ETF,True,usd,0001797318,2025-09-15T06:04:58.615036064Z
DECW,AllianzIM U.S. Large Cap Buffer20 Dec ETF,stocks,us,ARCX,ETS,True,usd,0001797318,2025-09-15T06:04:58.615036294Z
DECZ,TrueShares Structured Outcome (December) ETF,stocks,us,BATS,ETF,True,usd,0001776878,2025-09-15T06:04:58.615036374Z
DEED,First Trust Securitized Plus ETF,stocks,us,ARCX,ETF,True,usd,0001667919,2025-09-15T06:04:58.615036525Z
DEEF,Xtrackers FTSE Developed ex US Multifactor ETF,stocks,us,ARCX,ETF,True,usd,0001503123,2025-09-15T06:04:58.615036605Z
DEEP,Acquirers Small and Micro Deep Value ETF,stocks,us,ARCX,ETF,True,usd,0001539639,2025-09-15T06:04:58.615036685Z
DEFI,Hashdex Bitcoin ETF,stocks,us,ARCX,ETV,True,usd,0001985840,2025-09-15T06:04:58.615036765Z
DEFR,Aptus Deferred Income ETF,stocks,us,BATS,ETF,True,usd,0001539639,2025-09-15T06:04:58.615036855Z
DEFT,"Defi Technologies, Inc.",stocks,us,XNAS,CS,True,usd,0001888274,2025-09-15T06:04:58.615036935Z
DEHP,Dimensional Emerging Markets High Profitability ETF,stocks,us,ARCX,ETF,True,usd,0001816125,2025-09-15T06:04:58.615037046Z
DEI,"Douglas Emmett, Inc.",stocks,us,XNYS,CS,True,usd,0001364250,2025-09-15T06:04:58.615037126Z
DELL,Dell Technologies Inc.,stocks,us,XNYS,CS,True,usd,0001571996,2025-09-15T06:04:58.615037206Z
DEM,WisdomTree Emerging Markets High Dividend Fund,stocks,us,ARCX,ETF,True,usd,0001350487,2025-09-15T06:04:58.615037286Z
DEMZ,The Advisors' Inner Circle Fund III Democratic Large Cap Core ETF,stocks,us,XNAS,ETF,True,usd,,2025-09-15T06:04:58.615037366Z
DENN,DENNY'S CORP,stocks,us,XNAS,CS,True,usd,0000852772,2025-09-15T06:04:58.615037446Z
DEO,Diageo plc,stocks,us,XNYS,ADRC,True,usd,0000835403,2025-09-15T06:04:58.615037537Z
DERM,Journey Medical Corporation Common Stock,stocks,us,XNAS,CS,True,usd,0001867066,2025-09-15T06:04:58.615037617Z
DES,WisdomTree U.S. SmallCap Dividend Fund,stocks,us,ARCX,ETF,True,usd,0001350487,2025-09-15T06:04:58.615038018Z
DESK,VanEck Office and Commercial REIT ETF,stocks,us,ARCX,ETF,True,usd,0001137360,2025-09-15T06:04:58.615038098Z
DEUS,Xtrackers Russell US Multifactor ETF,stocks,us,ARCX,ETF,True,usd,0001503123,2025-09-15T06:04:58.615038188Z
DEVS,DevvStream Corp. Common Stock,stocks,us,XNAS,CS,True,usd,0001854480,2025-09-15T06:04:58.615038268Z
DEW,WisdomTree Global High Dividend Fund,stocks,us,ARCX,ETF,True,usd,0001350487,2025-09-15T06:04:58.615038348Z
DEXC,Dimensional Emerging Markets ex China Core Equity ETF,stocks,us,ARCX,ETF,True,usd,0001816125,2025-09-15T06:04:58.615038428Z
DFAC,Dimensional U.S. Core Equity 2 ETF,stocks,us,ARCX,ETF,True,usd,0001816125,2025-09-15T06:04:58.615038508Z
DFAE,Dimensional Emerging Core Equity Market ETF,stocks,us,ARCX,ETF,True,usd,0001816125,2025-09-15T06:04:58.615038589Z
DFAI,Dimensional International Core Equity Market ETF,stocks,us,ARCX,ETF,True,usd,0001816125,2025-09-15T06:04:58.615038719Z
DFAR,Dimensional US Real Estate ETF,stocks,us,ARCX,ETF,True,usd,0001816125,2025-09-15T06:04:58.615038799Z
DFAS,Dimensional U.S. Small Cap ETF,stocks,us,ARCX,ETF,True,usd,0001816125,2025-09-15T06:04:58.615038889Z
DFAT,Dimensional U.S. Targeted Value ETF,stocks,us,ARCX,ETF,True,usd,0001816125,2025-09-15T06:04:58.615038989Z
DFAU,Dimensional US Core Equity Market ETF,stocks,us,ARCX,ETF,True,usd,0001816125,2025-09-15T06:04:58.61503907Z
DFAW,Dimensional World Equity ETF,stocks,us,ARCX,ETF,True,usd,0001816125,2025-09-15T06:04:58.61503915Z
DFAX,Dimensional World ex U.S. Core Equity 2 ETF,stocks,us,ARCX,ETF,True,usd,0001816125,2025-09-15T06:04:58.61503924Z
DFCA,Dimensional California Municipal Bond ETF,stocks,us,ARCX,ETF,True,usd,0001816125,2025-09-15T06:04:58.61503932Z
DFCF,Dimensional Core Fixed Income ETF,stocks,us,ARCX,ETF,True,usd,0001816125,2025-09-15T06:04:58.615039701Z
DFDV,DeFi Development Corp. Common Stock,stocks,us,XNAS,CS,True,usd,0001805526,2025-09-15T06:04:58.615039791Z
DFE,WisdomTree Europe SmallCap Dividend Fund,stocks,us,ARCX,ETF,True,usd,0001350487,2025-09-15T06:04:58.615039951Z
DFEB,FT Vest U.S. Equity Deep Buffer ETF - February,stocks,us,BATS,ETF,True,usd,0001667919,2025-09-15T06:04:58.615040031Z
DFEM,Dimensional Emerging Markets Core Equity 2 ETF,stocks,us,ARCX,ETF,True,usd,0001816125,2025-09-15T06:04:58.615040142Z
DFEN,Direxion Daily Aerospace & Defense Bull 3X Shares,stocks,us,ARCX,ETF,True,usd,0001424958,2025-09-15T06:04:58.615040222Z
DFEV,Dimensional Emerging Markets Value ETF,stocks,us,ARCX,ETF,True,usd,0001816125,2025-09-15T06:04:58.615040312Z
DFGP,Dimensional Global Core Plus Fixed Income ETF,stocks,us,XNAS,ETF,True,usd,0001816125,2025-09-15T06:04:58.615040392Z
DFGR,Dimensional Global Real Estate ETF,stocks,us,ARCX,ETF,True,usd,0001816125,2025-09-15T06:04:58.615040482Z
DFGX,Dimensional Global ex US Core Fixed Income ETF,stocks,us,XNAS,ETF,True,usd,0001816125,2025-09-15T06:04:58.615040562Z
DFH,"Dream Finders Homes, Inc.",stocks,us,XNYS,CS,True,usd,0001825088,2025-09-15T06:04:58.615040643Z
DFIC,Dimensional International Core Equity 2 ETF,stocks,us,BATS,ETF,True,usd,0001816125,2025-09-15T06:04:58.615040743Z
DFII,FT Vest Bitcoin Strategy & Target Income ETF,stocks,us,ARCX,ETF,True,usd,0001329377,2025-09-15T06:04:58.615040833Z
DFIN,"Donnelley Financial Solutions, Inc.",stocks,us,XNYS,CS,True,usd,0001669811,2025-09-15T06:04:58.615040913Z
DFIP,Dimensional Inflation-Protected Securities ETF,stocks,us,ARCX,ETF,True,usd,0001816125,2025-09-15T06:04:58.615040993Z
DFIS,Dimensional International Small Cap ETF,stocks,us,BATS,ETF,True,usd,0001816125,2025-09-15T06:04:58.615041073Z
DFIV,Dimensional International Value ETF,stocks,us,ARCX,ETF,True,usd,0001816125,2025-09-15T06:04:58.615041294Z
DFJ,WisdomTree Japan SmallCap Dividend Fund,stocks,us,ARCX,ETF,True,usd,0001350487,2025-09-15T06:04:58.615041374Z
DFLI,Dragonfly Energy Holdings Corp. Common Stock (NV),stocks,us,XNAS,CS,True,usd,0001847986,2025-09-15T06:04:58.615041504Z
DFLIW,Dragonfly Energy Holdings Corp. Warrant,stocks,us,XNAS,WARRANT,True,usd,0001847986,2025-09-15T06:04:58.615041584Z
DFLV,Dimensional US Large Cap Value ETF,stocks,us,ARCX,ETF,True,usd,0001816125,2025-09-15T06:04:58.615041664Z
DFND,Siren DIVCON Dividend Defender ETF,stocks,us,BATS,ETF,True,usd,,2025-09-15T06:04:58.615041745Z
DFNL,Davis Select Financial ETF,stocks,us,BATS,ETF,True,usd,,2025-09-15T06:04:58.615041835Z
DFNM,Dimensional National Municipal Bond ETF,stocks,us,ARCX,ETF,True,usd,0001816125,2025-09-15T06:04:58.615041915Z
DFP,FLAHERTY & CRUMRINE DYNAMIC PREFERRED AND INCOME FUND INCORPORATED,stocks,us,XNYS,FUND,True,usd,0001559991,2025-09-15T06:04:58.615041995Z
DFSB,Dimensional Global Sustainability Fixed Income ETF,stocks,us,ARCX,ETF,True,usd,0001816125,2025-09-15T06:04:58.615042075Z
DFSC,DEFSEC Technologies Inc. Common Stock,stocks,us,XNAS,CS,True,usd,0001889823,2025-09-15T06:04:58.615042165Z
DFSCW,DEFSEC Technologies Inc. Warrant,stocks,us,XNAS,WARRANT,True,usd,0001889823,2025-09-15T06:04:58.615042246Z
DFSD,Dimensional Short-Duration Fixed Income ETF,stocks,us,ARCX,ETF,True,usd,0001816125,2025-09-15T06:04:58.615042326Z
DFSE,Dimensional Emerging Markets Sustainability Core 1 ETF,stocks,us,ARCX,ETF,True,usd,0001816125,2025-09-15T06:04:58.615042406Z
DFSI,Dimensional International Sustainability Core 1 ETF,stocks,us,ARCX,ETF,True,usd,0001816125,2025-09-15T06:04:58.615042486Z
