ticker,name,market,locale,primary_exchange,type,active,currency_name,cik,last_updated_utc
FBUF,Fidelity Dynamic Buffered Equity ETF,stocks,us,BATS,ETF,True,usd,0001898391,2025-09-15T06:04:58.615132788Z
FBY,YieldMax META Option Income Strategy ETF,stocks,us,ARCX,ETS,True,usd,,2025-09-15T06:04:58.615132868Z
FBYD,"Falcon's Beyond Global, Inc. Class A Common Stock",stocks,us,XNAS,CS,True,usd,0001937987,2025-09-15T06:04:58.615132979Z
FBYDW,"Falcon's Beyond Global, Inc. Warrants",stocks,us,XNAS,WARRANT,True,usd,0001937987,2025-09-15T06:04:58.615133069Z
FC,Franklin Covey Company,stocks,us,XNYS,CS,True,usd,0000886206,2025-09-15T06:04:58.615133149Z
FCA,First Trust China AlphaDEX Fund,stocks,us,XNAS,ETF,True,usd,0001510337,2025-09-15T06:04:58.615133229Z
FCAL,First Trust California Municipal High income ETF,stocks,us,XNAS,ETF,True,usd,0001424212,2025-09-15T06:04:58.615133319Z
FCAP,First Capital Inc,stocks,us,XNAS,CS,True,usd,0001070296,2025-09-15T06:04:58.615133399Z
FCBC,"First Community Bankshares, Inc. (VA)",stocks,us,XNAS,CS,True,usd,0000859070,2025-09-15T06:04:58.61513348Z
FCBD,Frontier Asset Core Bond ETF,stocks,us,ARCX,ETF,True,usd,,2025-09-15T06:04:58.61513356Z
FCCO,First Community Corp,stocks,us,XNAS,CS,True,usd,0000932781,2025-09-15T06:04:58.61513365Z
FCEF,First Trust Exchange-Traded Fund VIII First Trust Income Opportunities ETF,stocks,us,XNAS,ETF,True,usd,0001667919,2025-09-15T06:04:58.61513378Z
FCEL,FuelCell Energy Inc  NEW (DE),stocks,us,XNAS,CS,True,usd,0000886128,2025-09-15T06:04:58.61513386Z
FCF,First Commonwealth Financial Corporation,stocks,us,XNYS,CS,True,usd,0000712537,2025-09-15T06:04:58.615133941Z
FCFS,"FirstCash Holdings, Inc. Common Stock",stocks,us,XNAS,CS,True,usd,0000840489,2025-09-15T06:04:58.615134131Z
FCFY,First Trust S&P 500 Diversified Free Cash Flow ETF,stocks,us,ARCX,ETF,True,usd,0001329377,2025-09-15T06:04:58.615134241Z
FCG,First Trust Natural Gas ETF,stocks,us,ARCX,ETF,True,usd,0001329377,2025-09-15T06:04:58.615134321Z
FCHL,Fitness Champs Holdings Limited Common Stock,stocks,us,XNAS,CS,True,usd,0002023796,2025-09-15T06:04:58.615134401Z
FCLD,Fidelity Cloud Computing ETF,stocks,us,BATS,ETF,True,usd,0000945908,2025-09-15T06:04:58.615134492Z
FCN,"FTI Consulting, Inc.",stocks,us,XNYS,CS,True,usd,0000887936,2025-09-15T06:04:58.615134572Z
FCNCA,First Citizens BancShares Inc,stocks,us,XNAS,CS,True,usd,0000798941,2025-09-15T06:04:58.615134652Z
FCNCO,"First Citizens BancShares, Inc. 5.625% Non-Cumulative Perpetual Preferred Stock, Series C",stocks,us,XNAS,PFD,True,usd,,2025-09-15T06:04:58.615134732Z
FCNCP,"First Citizens BancShares, Inc. Depositary Shares Each Representing a 1/40th Interest in a Share of 5.375% Non-Cumulative Perpetual Preferred Stock, Series A",stocks,us,XNAS,PFD,True,usd,,2025-09-15T06:04:58.615134812Z
FCO,"abrdn Global Income Fund, Inc.",stocks,us,XASE,FUND,True,usd,0000876717,2025-09-15T06:04:58.615134892Z
FCOM,Fidelity MSCI Communication Services Index ETF,stocks,us,ARCX,ETF,True,usd,0000945908,2025-09-15T06:04:58.615134973Z
FCOR,Fidelity Corporate Bond ETF,stocks,us,ARCX,ETF,True,usd,0001562565,2025-09-15T06:04:58.615135063Z
FCPI,Fidelity Stocks for Inflation ETF,stocks,us,BATS,ETF,True,usd,0000945908,2025-09-15T06:04:58.615135143Z
FCPT,"Four Corners Property Trust, Inc.",stocks,us,XNYS,CS,True,usd,0001650132,2025-09-15T06:04:58.615135223Z
FCRX,"Crescent Capital BDC, Inc. 5.00% Notes due 2026",stocks,us,XNYS,SP,True,usd,0001633336,2025-09-15T06:04:58.615135313Z
FCSH,Federated Hermes Short Duration Corporate ETF,stocks,us,ARCX,ETF,True,usd,0001849998,2025-09-15T06:04:58.615135393Z
FCT,First Trust Senior Floating Rate Income Fund II,stocks,us,XNYS,FUND,True,usd,0001282850,2025-09-15T06:04:58.615135584Z
FCTE,SMI 3Fourteen Full-Cycle Trend ETF,stocks,us,XNAS,ETF,True,usd,,2025-09-15T06:04:58.615135664Z
FCTR,First Trust Lunt U.S. Factor Rotation ETF,stocks,us,BATS,ETF,True,usd,0001329377,2025-09-15T06:04:58.615135794Z
FCUS,Pinnacle Focused Opportunities ETF,stocks,us,ARCX,ETF,True,usd,,2025-09-15T06:04:58.615135884Z
FCUV,Focus Universal Inc. Common Stock,stocks,us,XNAS,CS,True,usd,0001590418,2025-09-15T06:04:58.615135974Z
FCVT,First Trust SSI Strategic Convertible Securities ETF,stocks,us,XNAS,ETF,True,usd,0001517936,2025-09-15T06:04:58.615136055Z
FCX,Freeport-McMoran Inc.,stocks,us,XNYS,CS,True,usd,0000831259,2025-09-15T06:04:58.615136135Z
FDAT,Tactical Advantage ETF,stocks,us,ARCX,ETF,True,usd,0001924868,2025-09-15T06:04:58.615136215Z
FDBC,"Fidelity D & D Bancorp, Inc. Common Stock",stocks,us,XNAS,CS,True,usd,0001098151,2025-09-15T06:04:58.615136295Z
FDCF,Fidelity Disruptive Communications ETF,stocks,us,XNAS,ETF,True,usd,0000945908,2025-09-15T06:04:58.615136385Z
FDD,First Trust STOXX European Select Dividend Income Fund,stocks,us,ARCX,ETF,True,usd,0001364608,2025-09-15T06:04:58.615136465Z
FDEC,FT Vest U.S. Equity Buffer ETF - December,stocks,us,BATS,ETF,True,usd,0001667919,2025-09-15T06:04:58.615136546Z
FDEM,Fidelity Emerging Markets Multifactor ETF,stocks,us,BATS,ETF,True,usd,0000945908,2025-09-15T06:04:58.615136626Z
FDEV,Fidelity International Multifactor ETF,stocks,us,BATS,ETF,True,usd,0000945908,2025-09-15T06:04:58.615136706Z
FDFF,Fidelity Disruptive Finance ETF,stocks,us,XNAS,ETF,True,usd,0000945908,2025-09-15T06:04:58.615136786Z
FDG,American Century Focused Dynamic Growth ETF,stocks,us,ARCX,ETF,True,usd,0001710607,2025-09-15T06:04:58.615136866Z
FDHT,Fidelity Digital Health ETF,stocks,us,BATS,ETF,True,usd,0000945908,2025-09-15T06:04:58.615137117Z
FDHY,Fidelity Enhanced High Yield ETF,stocks,us,ARCX,ETF,True,usd,0000945908,2025-09-15T06:04:58.615137197Z
FDIF,Fidelity Disruptors ETF,stocks,us,XNAS,ETF,True,usd,0000945908,2025-09-15T06:04:58.615137327Z
FDIG,Fidelity Crypto Industry and Digital Payments ETF,stocks,us,XNAS,ETF,True,usd,0000945908,2025-09-15T06:04:58.615137417Z
FDIS,Fidelity MSCI Consumer Discretionary Index ETF,stocks,us,ARCX,ETF,True,usd,0000945908,2025-09-15T06:04:58.615137497Z
FDIV,MarketDesk Focused U.S. Dividend ETF,stocks,us,XNAS,ETF,True,usd,,2025-09-15T06:04:58.615137577Z
FDL,First Trust Morningstar Dividend Leaders Index Fund,stocks,us,ARCX,ETF,True,usd,,2025-09-15T06:04:58.615137658Z
FDLO,Fidelity Low Volatility Factor ETF,stocks,us,ARCX,ETF,True,usd,0000945908,2025-09-15T06:04:58.615137738Z
FDLS,Inspire Fidelis Multi Factor ETF,stocks,us,ARCX,ETF,True,usd,0001733356,2025-09-15T06:04:58.615137828Z
FDM,First Trust Dow Jones Select MicroCap Index Fund,stocks,us,ARCX,ETF,True,usd,0001329377,2025-09-15T06:04:58.615137908Z
FDMO,Fidelity Momentum Factor ETF,stocks,us,ARCX,ETF,True,usd,0000945908,2025-09-15T06:04:58.615137988Z
FDMT,"4D Molecular Therapeutics, Inc. Common Stock",stocks,us,XNAS,CS,True,usd,0001650648,2025-09-15T06:04:58.615138068Z
FDN,First Trust Dow Jones Internet Index Fund ETF,stocks,us,ARCX,ETF,True,usd,0001329377,2025-09-15T06:04:58.615138159Z
FDND,FT Vest Dow Jones Internet & Target Income ETF,stocks,us,BATS,ETF,True,usd,0001517936,2025-09-15T06:04:58.615138239Z
FDNI,First Trust Dow Jones International Internet ETF,stocks,us,XNAS,ETF,True,usd,0001125816,2025-09-15T06:04:58.615138319Z
FDP,Fresh Del Monte Produce Inc.,stocks,us,XNYS,CS,True,usd,0001047340,2025-09-15T06:04:58.615138399Z
FDRR,Fidelity Dividend ETF for Rising Rates,stocks,us,ARCX,ETF,True,usd,0000945908,2025-09-15T06:04:58.615138479Z
FDRV,Fidelity Electric Vehicles and Future Transportation ETF,stocks,us,BATS,ETF,True,usd,0000945908,2025-09-15T06:04:58.615138559Z
FDS,Factset Research Systems,stocks,us,XNYS,CS,True,usd,0001013237,2025-09-15T06:04:58.61513865Z
FDSB,"Fifth District Bancorp, Inc. Common Stock",stocks,us,XNAS,CS,True,usd,0002012726,2025-09-15T06:04:58.61513873Z
FDT,First Trust Developed Markets ex-US AlphaDEX Fund,stocks,us,XNAS,ETF,True,usd,0001510337,2025-09-15T06:04:58.61513881Z
FDTS,First Trust Developed Markets ex-US Small Cap AlphaDEX Fund,stocks,us,XNAS,ETF,True,usd,0001510337,2025-09-15T06:04:58.61513889Z
FDTX,Fidelity Disruptive Technology ETF,stocks,us,XNAS,ETF,True,usd,0000945908,2025-09-15T06:04:58.61513897Z
FDUS,Fidus Investment Corp.,stocks,us,XNAS,CS,True,usd,0001513363,2025-09-15T06:04:58.61513905Z
FDV,Federated Hermes U.S. Strategic Dividend ETF,stocks,us,ARCX,ETF,True,usd,0001849998,2025-09-15T06:04:58.61513913Z
FDVV,Fidelity High Dividend ETF,stocks,us,ARCX,ETF,True,usd,0000945908,2025-09-15T06:04:58.615139221Z
FDWM,Fidelity Women's Leadership ETF,stocks,us,ARCX,ETF,True,usd,0000945908,2025-09-15T06:04:58.615139621Z
FDX,FedEx Corporation,stocks,us,XNYS,CS,True,usd,0001048911,2025-09-15T06:04:58.615139702Z
FE,FirstEnergy Corp.,stocks,us,XNYS,CS,True,usd,0001031296,2025-09-15T06:04:58.615139792Z
FEAC,Fidelity Enhanced U.S. All-Cap Equity ETF,stocks,us,ARCX,ETF,True,usd,0000945908,2025-09-15T06:04:58.615139872Z
FEAM,"5E Advanced Materials, Inc. Common Stock",stocks,us,XNAS,CS,True,usd,0001888654,2025-09-15T06:04:58.615139972Z
FEAT,YieldMax Dorsey Wright Featured 5 Income ETF,stocks,us,XNAS,ETF,True,usd,,2025-09-15T06:04:58.615140062Z
FEBM,FT Vest U.S. Equity Max Buffer ETF - February,stocks,us,BATS,ETF,True,usd,0001667919,2025-09-15T06:04:58.615140293Z
FEBO,Fenbo Holdings Limited Ordinary Shares,stocks,us,XNAS,CS,True,usd,0001957001,2025-09-15T06:04:58.615140373Z
FEBP,PGIM S&P 500 Buffer 12 ETF - February,stocks,us,BATS,ETF,True,usd,,2025-09-15T06:04:58.615140503Z
FEBT,AllianzIM U.S. Large Cap Buffer10 Feb ETF,stocks,us,ARCX,ETS,True,usd,0001797318,2025-09-15T06:04:58.615140583Z
FEBU,AllianzIM U.S. Equity Buffer15 Uncapped Feb ETF,stocks,us,BATS,ETF,True,usd,0001797318,2025-09-15T06:04:58.615140673Z
FEBW,AllianzIM U.S. Large Cap Buffer20 Feb ETF,stocks,us,ARCX,ETS,True,usd,0001797318,2025-09-15T06:04:58.615140754Z
FEBZ,TrueShares Structured Outcome (February) ETF,stocks,us,BATS,ETF,True,usd,0001776878,2025-09-15T06:04:58.615140854Z
FEDM,FlexShares ESG & Climate Developed Markets ex-US Core Index Fund,stocks,us,ARCX,ETF,True,usd,0001491978,2025-09-15T06:04:58.615140934Z
FEDU,"Four Seasons Education (Cayman) Inc. American depositary shares, each representing ten (10) Ordinary Shares",stocks,us,XNYS,ADRC,True,usd,0001709819,2025-09-15T06:04:58.615141014Z
FEGE,First Eagle Global Equity ETF,stocks,us,XNYS,ETF,True,usd,,2025-09-15T06:04:58.615141094Z
FEIG,FlexShares ESG & Climate Investment Grade Corporate Core Index Fund,stocks,us,ARCX,ETF,True,usd,0001491978,2025-09-15T06:04:58.615141174Z
FEIM,"Frequency Electronics, Inc.",stocks,us,XNAS,CS,True,usd,0000039020,2025-09-15T06:04:58.615141275Z
FELC,Fidelity Enhanced Large Cap Core ETF,stocks,us,ARCX,ETF,True,usd,0000945908,2025-09-15T06:04:58.615141365Z
FELE,Franklin Electric Co Inc,stocks,us,XNAS,CS,True,usd,0000038725,2025-09-15T06:04:58.615141445Z
FELG,Fidelity Enhanced Large Cap Growth ETF,stocks,us,ARCX,ETF,True,usd,0000945908,2025-09-15T06:04:58.615141525Z
FELV,Fidelity Enhanced Large Cap Value ETF,stocks,us,ARCX,ETF,True,usd,0000945908,2025-09-15T06:04:58.615141615Z
FEM,First Trust Emerging Markets AlphaDEX Fund,stocks,us,XNAS,ETF,True,usd,0001510337,2025-09-15T06:04:58.615141695Z
FEMB,First Trust Emerging Markets Local Currency Bond ETF,stocks,us,XNAS,ETF,True,usd,0001424212,2025-09-15T06:04:58.615141775Z
FEMR,Fidelity Enhanced Emerging Markets ETF,stocks,us,ARCX,ETF,True,usd,0000945908,2025-09-15T06:04:58.615141856Z
FEMS,First Trust Emerging Markets Small Cap AlphaDEX Fund,stocks,us,XNAS,ETF,True,usd,0001364608,2025-09-15T06:04:58.615141936Z
FEMY,Femasys Inc. Common Stock,stocks,us,XNAS,CS,True,usd,0001339005,2025-09-15T06:04:58.615142016Z
FENC,Fennec Pharmaceuticals Inc. Common Stock,stocks,us,XNAS,CS,True,usd,0001211583,2025-09-15T06:04:58.615142096Z
FENG,Phoenix New Media Limited American Depositary Shares (each representing forty-eight (48) Class A Ordinary Shares),stocks,us,XNYS,ADRC,True,usd,0001509646,2025-09-15T06:04:58.615142186Z
FENI,Fidelity Enhanced International ETF,stocks,us,ARCX,ETF,True,usd,0000945908,2025-09-15T06:04:58.615142266Z
FENY,Fidelity MSCI Energy Index ETF,stocks,us,ARCX,ETF,True,usd,0000945908,2025-09-15T06:04:58.615142367Z
FEOE,First Eagle Overseas Equity ETF,stocks,us,XNYS,ETF,True,usd,,2025-09-15T06:04:58.615142447Z
FEP,First Trust Europe AlphaDEX Fund,stocks,us,XNAS,ETF,True,usd,0001510337,2025-09-15T06:04:58.615142527Z
FEPI,REX FANG & Innovation Equity Premium Income ETF,stocks,us,XNAS,ETF,True,usd,0000726516,2025-09-15T06:04:58.615142607Z
FER,Ferrovial SE Ordinary Shares,stocks,us,XNAS,CS,True,usd,0001468522,2025-09-15T06:04:58.615142687Z
FERA,Fifth Era Acquisition Corp I Class A Ordinary Shares,stocks,us,XNAS,CS,True,usd,0002025401,2025-09-15T06:04:58.615142767Z
FERAR,Fifth Era Acquisition Corp I Rights,stocks,us,XNAS,RIGHT,True,usd,0002025401,2025-09-15T06:04:58.615142848Z
FERAU,Fifth Era Acquisition Corp I Units,stocks,us,XNAS,UNIT,True,usd,0002025401,2025-09-15T06:04:58.615142928Z
FERG,Ferguson Enterprises Inc.,stocks,us,XNYS,CS,True,usd,0002011641,2025-09-15T06:04:58.615143018Z
FESM,Fidelity Enhanced Small Cap ETF,stocks,us,ARCX,ETF,True,usd,0000945908,2025-09-15T06:04:58.615143098Z
FET,"Forum Energy Technologies, Inc.",stocks,us,XNYS,CS,True,usd,0001401257,2025-09-15T06:04:58.615143178Z
FETH,Fidelity Ethereum Fund,stocks,us,BATS,ETF,True,usd,0002000046,2025-09-15T06:04:58.615143258Z
FEUS,FlexShares ESG & Climate US Large Cap Core Index Fund,stocks,us,ARCX,ETF,True,usd,0001491978,2025-09-15T06:04:58.615143338Z
FEUZ,First Trust Eurozone AlphaDEX,stocks,us,XNAS,ETF,True,usd,0001510337,2025-09-15T06:04:58.615143419Z
FEX,First Trust Large Cap Core AlphaDEX Fund,stocks,us,XNAS,ETF,True,usd,,2025-09-15T06:04:58.615143499Z
FEZ,SPDR EURO STOXX 50 ETF,stocks,us,ARCX,ETF,True,usd,0001168164,2025-09-15T06:04:58.615143579Z
FF,Future Fuel Corporation,stocks,us,XNYS,CS,True,usd,0001337298,2025-09-15T06:04:58.615143669Z
FFA,First Trust Enhanced Equity Income Fund.,stocks,us,XNYS,FUND,True,usd,0001291334,2025-09-15T06:04:58.615143749Z
FFAI,Faraday Future Intelligent Electric Inc. Common Stock,stocks,us,XNAS,CS,True,usd,0001805521,2025-09-15T06:04:58.615143829Z
FFAIW,Faraday Future Intelligent Electric Inc. Warrant,stocks,us,XNAS,WARRANT,True,usd,0001805521,2025-09-15T06:04:58.61514392Z
FFBC,First Financial Bancorp,stocks,us,XNAS,CS,True,usd,0000708955,2025-09-15T06:04:58.615144Z
FFC,Flaherty & Crumrine Preferred and Income Securities Fund Incorporated,stocks,us,XNYS,FUND,True,usd,0001174164,2025-09-15T06:04:58.61514408Z
FFDI,Fidelity Fundamental Developed International ETF,stocks,us,BATS,ETF,True,usd,0000945908,2025-09-15T06:04:58.61514416Z
FFEB,FT Vest U.S. Equity Buffer ETF - February,stocks,us,BATS,ETF,True,usd,0001667919,2025-09-15T06:04:58.61514424Z
FFEM,Fidelity Fundamental Emerging Markets ETF,stocks,us,BATS,ETF,True,usd,0000945908,2025-09-15T06:04:58.615144491Z
FFGX,Fidelity Fundamental Global ex-U.S. ETF,stocks,us,BATS,ETF,True,usd,0000945908,2025-09-15T06:04:58.615144571Z
FFIC,Flushing Financial Corp,stocks,us,XNAS,CS,True,usd,0000923139,2025-09-15T06:04:58.615144711Z
FFIN,First Financial Bankshares Inc,stocks,us,XNAS,CS,True,usd,0000036029,2025-09-15T06:04:58.615144791Z
FFIU,UVA Unconstrained Medium-Term Fixed Income ETF,stocks,us,ARCX,ETF,True,usd,0001484018,2025-09-15T06:04:58.615144881Z
FFIV,"F5, Inc. Common Stock",stocks,us,XNAS,CS,True,usd,0001048695,2025-09-15T06:04:58.615144962Z
FFLC,Fidelity Fundamental Large Cap Core ETF,stocks,us,BATS,ETF,True,usd,0000945908,2025-09-15T06:04:58.615145042Z
FFLG,Fidelity Fundamental Large Cap Growth ETF,stocks,us,BATS,ETF,True,usd,0000945908,2025-09-15T06:04:58.615145122Z
FFLS,The Future Fund Long/Short ETF,stocks,us,ARCX,ETF,True,usd,,2025-09-15T06:04:58.615145543Z
FFLV,Fidelity Fundamental Large Cap Value ETF,stocks,us,BATS,ETF,True,usd,0000945908,2025-09-15T06:04:58.615145623Z
FFND,One Global ETF,stocks,us,ARCX,ETF,True,usd,,2025-09-15T06:04:58.615145713Z
FFOG,Franklin Focused Growth ETF,stocks,us,BATS,ETF,True,usd,0001655589,2025-09-15T06:04:58.615145793Z
FFOX,FundX Future Fund Opportunities ETF,stocks,us,ARCX,ETF,True,usd,,2025-09-15T06:04:58.615145873Z
FFSM,Fidelity Fundamental Small-Mid Cap ETF,stocks,us,BATS,ETF,True,usd,0000945908,2025-09-15T06:04:58.615145953Z
FFTY,Innovator IBD 50 ETF,stocks,us,ARCX,ETF,True,usd,0001482688,2025-09-15T06:04:58.615146034Z
FFUT,Fidelity Managed Futures ETF,stocks,us,XNAS,ETF,True,usd,0001898391,2025-09-15T06:04:58.615146114Z
FFWM,First Foundation Inc.,stocks,us,XNYS,CS,True,usd,0001413837,2025-09-15T06:04:58.615146314Z
FG,"F&G Annuities & Life, Inc.",stocks,us,XNYS,CS,True,usd,0001934850,2025-09-15T06:04:58.615146394Z
FGBI,FIRST GUARANTY BANCSHARES INC,stocks,us,XNAS,CS,True,usd,0001408534,2025-09-15T06:04:58.615146505Z
FGBIP,"First Guaranty Bancshares, Inc. 6.75% Series A Fixed-Rate Non-Cumulative Perpetual Preferred Stock",stocks,us,XNAS,PFD,True,usd,0001408534,2025-09-15T06:04:58.615146585Z
FGD,First Trust Dow Jones Global Select Dividend Index Fund,stocks,us,ARCX,ETF,True,usd,0001364608,2025-09-15T06:04:58.615146665Z
FGDL,Franklin Responsibly Sourced Gold ETF,stocks,us,ARCX,ETV,True,usd,0001858258,2025-09-15T06:04:58.615146755Z
FGEN,"FibroGen, Inc",stocks,us,XNAS,CS,True,usd,0000921299,2025-09-15T06:04:58.615146835Z
FGI,FGI Industries Ltd. Ordinary Shares,stocks,us,XNAS,CS,True,usd,0001864943,2025-09-15T06:04:58.615146915Z
FGIWW,FGI Industries Ltd. Warrant,stocks,us,XNAS,WARRANT,True,usd,0001864943,2025-09-15T06:04:58.615146995Z
FGL,Founder Group Limited Class A Ordinary Shares,stocks,us,XNAS,CS,True,usd,0001989930,2025-09-15T06:04:58.615147096Z
FGM,First Trust Germany AlphaDEX Fund,stocks,us,XNAS,ETF,True,usd,0001510337,2025-09-15T06:04:58.615147186Z
FGMC,FG Merger II Corp. Common stock,stocks,us,XNAS,CS,True,usd,0001906364,2025-09-15T06:04:58.615147266Z
FGMCR,FG Merger II Corp. Rights,stocks,us,XNAS,RIGHT,True,usd,0001906364,2025-09-15T06:04:58.615147577Z
FGMCU,FG Merger II Corp. Unit,stocks,us,XNAS,UNIT,True,usd,0001906364,2025-09-15T06:04:58.615147657Z
FGN,"F&G Annuities & Life, Inc. 7.950% Senior Notes due 2053",stocks,us,XNYS,SP,True,usd,0001934850,2025-09-15T06:04:58.615147737Z
FGNX,FG Nexus Inc. Common Stock,stocks,us,XNAS,CS,True,usd,0001591890,2025-09-15T06:04:58.615147857Z
FGNXP,FG Nexus Inc. 8.00% Cumulative Preferred Stock,stocks,us,XNAS,PFD,True,usd,0001591890,2025-09-15T06:04:58.615148268Z
FGSI,FT Vest Growth Strength & Target Income ETF,stocks,us,XNAS,ETF,True,usd,0001517936,2025-09-15T06:04:58.615148348Z
FGSM,Frontier Asset Global Small Cap Equity ETF,stocks,us,ARCX,ETF,True,usd,,2025-09-15T06:04:58.615148478Z
FGSN,"F&G Annuities & Life, Inc. 7.300% Junior Subordinated Notes due 2065",stocks,us,XNYS,SP,True,usd,0001934850,2025-09-15T06:04:58.615148558Z
FHB,"First Hawaiian, Inc. Common Stock",stocks,us,XNAS,CS,True,usd,0000036377,2025-09-15T06:04:58.615148639Z
FHDG,FT Vest U.S. Equity Quarterly Dynamic Buffer ETF,stocks,us,BATS,ETF,True,usd,0001667919,2025-09-15T06:04:58.615148719Z
FHEQ,Fidelity Hedged Equity ETF,stocks,us,BATS,ETF,True,usd,0001898391,2025-09-15T06:04:58.615148809Z
FHI,"Federated Hermes, Inc.",stocks,us,XNYS,CS,True,usd,0001056288,2025-09-15T06:04:58.615148889Z
FHLC,Fidelity MSCI Health Care Index ETF,stocks,us,ARCX,ETF,True,usd,0000945908,2025-09-15T06:04:58.615148969Z
FHN,First Horizon Corporation,stocks,us,XNYS,CS,True,usd,0000036966,2025-09-15T06:04:58.615149049Z
FHNpC,"First Horizon Corporation Depositary Shares, each representing a 1/400th interest in a share of Non-Cumulative Perpetual Preferred Stock, Series C",stocks,us,XNYS,PFD,True,usd,0000036966,2025-09-15T06:04:58.61514913Z
FHNpE,"First Horizon Corporation Depositary Shares, Each Representing a 1/ 4000th Interest in a Share of Non-cumulative Perpetual Series E Preferred Stock",stocks,us,XNYS,PFD,True,usd,0000036966,2025-09-15T06:04:58.61514921Z
FHNpF,"First Horizon Corporation Depositary Shares, each representing 1/4000th Interest in a Share of Non-Cumulative Perpetual Preferred Stock, Series F",stocks,us,XNYS,PFD,True,usd,0000036966,2025-09-15T06:04:58.61514929Z
FHTX,Foghorn Therapeutics Inc. Common Stock,stocks,us,XNAS,CS,True,usd,0001822462,2025-09-15T06:04:58.61514937Z
FHYS,Federated Hermes Short Duration High Yield ETF,stocks,us,ARCX,ETF,True,usd,0001849998,2025-09-15T06:04:58.61514946Z
FI,"Fiserv, Inc.",stocks,us,XNYS,CS,True,usd,0000798354,2025-09-15T06:04:58.61514955Z
FIAT,YieldMax Short COIN Option Income Strategy ETF,stocks,us,ARCX,ETS,True,usd,0001924868,2025-09-15T06:04:58.615149741Z
FIAX,Nicholas Fixed Income Alternative ETF,stocks,us,ARCX,ETF,True,usd,,2025-09-15T06:04:58.615149821Z
FIBK,"First Interstate BancSystem, Inc. Common Stock (DE)",stocks,us,XNAS,CS,True,usd,0000860413,2025-09-15T06:04:58.615149941Z
FICO,Fair Isaac Corporation,stocks,us,XNYS,CS,True,usd,0000814547,2025-09-15T06:04:58.615150021Z
FICS,First Trust International Developed Capital Strength ETF,stocks,us,XNAS,ETF,True,usd,0001552740,2025-09-15T06:04:58.615150101Z
FID,First Trust Exchange-Traded Fund VI First Trust S&P International Dividend Aristocrats ETF,stocks,us,XNAS,ETF,True,usd,0001552740,2025-09-15T06:04:58.615150182Z
FIDI,Fidelity International High Dividend ETF,stocks,us,ARCX,ETF,True,usd,0000945908,2025-09-15T06:04:58.615150262Z
FIDU,Fidelity MSCI Industrials Index ETF,stocks,us,ARCX,ETF,True,usd,0000945908,2025-09-15T06:04:58.615150342Z
FIEE,"FiEE, Inc Common Stock",stocks,us,XNAS,CS,True,usd,0001467761,2025-09-15T06:04:58.615150432Z
FIG,"Figma, Inc.",stocks,us,XNYS,CS,True,usd,0001579878,2025-09-15T06:04:58.615150522Z
FIGB,Fidelity Investment Grade Bond ETF,stocks,us,ARCX,ETF,True,usd,0001562565,2025-09-15T06:04:58.615150602Z
FIGR,"Figure Technology Solutions, Inc. Class A Common Stock",stocks,us,XNAS,CS,True,usd,0002064124,2025-09-15T06:04:58.615150682Z
FIGS,"FIGS, Inc.",stocks,us,XNYS,CS,True,usd,0001846576,2025-09-15T06:04:58.615150763Z
FIGX,FIGX Capital Acquisition Corp. Class A Ordinary Share,stocks,us,XNAS,CS,True,usd,0002059033,2025-09-15T06:04:58.615150843Z
FIGXU,FIGX Capital Acquisition Corp. Units,stocks,us,XNAS,UNIT,True,usd,0002059033,2025-09-15T06:04:58.615150923Z
FIGXW,FIGX Capital Acquisition Corp. Warrant,stocks,us,XNAS,WARRANT,True,usd,0002059033,2025-09-15T06:04:58.615151003Z
FIHL,Fidelis Insurance Holdings Limited,stocks,us,XNYS,CS,True,usd,0001636639,2025-09-15T06:04:58.615151103Z
FIIG,First Trust Intermediate Duration Investment Grade Corporate ETF,stocks,us,ARCX,ETF,True,usd,0001517936,2025-09-15T06:04:58.615151183Z
FILL,iShares MSCI Global Energy Producers ETF,stocks,us,ARCX,ETF,True,usd,0001100663,2025-09-15T06:04:58.615151264Z
FINE,Themes European Luxury ETF,stocks,us,XNAS,ETF,True,usd,0001976322,2025-09-15T06:04:58.615151364Z
FINS,Angel Oak Financial Strategies Income Term Trust,stocks,us,XNYS,FUND,True,usd,0001745059,2025-09-15T06:04:58.615151454Z
FINT,Frontier Asset Total International Equity ETF,stocks,us,ARCX,ETF,True,usd,,2025-09-15T06:04:58.615151534Z
FINV,"FinVolution Group American depositary shares, each representing five Class A ordinary shares",stocks,us,XNYS,ADRC,True,usd,0001691445,2025-09-15T06:04:58.615151614Z
FINW,FinWise Bancorp Common,stocks,us,XNAS,CS,True,usd,0001856365,2025-09-15T06:04:58.615151694Z
FINX,Global X Funds Global X FinTech ETF,stocks,us,XNAS,ETF,True,usd,0001432353,2025-09-15T06:04:58.615151775Z
FIP,FTAI Infrastructure Inc. Common Stock,stocks,us,XNAS,CS,True,usd,0001899883,2025-09-15T06:04:58.615151855Z
FIRI,FIRE Funds Income Target ETF,stocks,us,ARCX,ETF,True,usd,0001387131,2025-09-15T06:04:58.615151935Z
FIRS,FIRE Funds Wealth Builder ETF,stocks,us,ARCX,ETF,True,usd,0001387131,2025-09-15T06:04:58.615152015Z
FIS,"Fidelity National Information Services, Inc.",stocks,us,XNYS,CS,True,usd,0001136893,2025-09-15T06:04:58.615152105Z
FISI,Financial Institutions Inc,stocks,us,XNAS,CS,True,usd,0000862831,2025-09-15T06:04:58.615152185Z
FISK,"Empire State Realty OP, L.P. Series 250",stocks,us,ARCX,UNIT,True,usd,0001553079,2025-09-15T06:04:58.615152265Z
FISR,SPDR SSGA Fixed Income Sector Rotation ETF,stocks,us,ARCX,ETF,True,usd,0001516212,2025-09-15T06:04:58.615152346Z
FITB,Fifth Third Bancorp,stocks,us,XNAS,CS,True,usd,0000035527,2025-09-15T06:04:58.615152556Z
FITBI,Fifth Third Bancorp Depositary Shares,stocks,us,XNAS,ADRC,True,usd,0000035527,2025-09-15T06:04:58.615152636Z
FITBO,"Fifth Third Bancorp Depositary Shares each representing a 1/1000th ownership interest in a share of Non-Cumulative Perpetual Preferred Stock, Series K",stocks,us,XNAS,CS,True,usd,0000035527,2025-09-15T06:04:58.615152736Z
FITBP,"Fifth Third Bancorp Depositary Shares each representing 1/40th share of Fifth Third 6.00% Non-Cumulative Perpetual Class B Preferred Stock, Series A",stocks,us,XNAS,PFD,True,usd,0000035527,2025-09-15T06:04:58.615152817Z
FITE,SPDR S&P Kensho Future Security ETF,stocks,us,ARCX,ETF,True,usd,0001081019,2025-09-15T06:04:58.615152897Z
FIVA,Fidelity International Value Factor ETF,stocks,us,ARCX,ETF,True,usd,0000945908,2025-09-15T06:04:58.615152977Z
FIVE,"Five Below, Inc. Common Stock",stocks,us,XNAS,CS,True,usd,0001177609,2025-09-15T06:04:58.615153257Z
FIVN,"FIVE9, INC.",stocks,us,XNAS,CS,True,usd,0001288847,2025-09-15T06:04:58.615153338Z
FIVY,YieldMax Dorsey Wright Hybrid 5 Income ETF,stocks,us,XNAS,ETF,True,usd,,2025-09-15T06:04:58.615153418Z
FIW,First Trust Water ETF,stocks,us,ARCX,ETF,True,usd,,2025-09-15T06:04:58.615153498Z
FIX,"Comfort Systems USA, Inc.",stocks,us,XNYS,CS,True,usd,0001035983,2025-09-15T06:04:58.615153588Z
FIXD,First Trust Exchange-Traded Fund VIII First Trust Smith Opportunistic Fixed Income ETF,stocks,us,XNAS,ETF,True,usd,0001667919,2025-09-15T06:04:58.615153668Z
FIXP,FolioBeyond Enhanced Fixed Income Premium ETF,stocks,us,ARCX,ETF,True,usd,0001387131,2025-09-15T06:04:58.615153748Z
FIXT,TCW Core Plus Bond ETF,stocks,us,XNYS,ETF,True,usd,,2025-09-15T06:04:58.615153828Z
FIZZ,National Beverage Corp.,stocks,us,XNAS,CS,True,usd,0000069891,2025-09-15T06:04:58.615153909Z
FJAN,FT Vest U.S. Equity Buffer ETF - January,stocks,us,BATS,ETF,True,usd,0001667919,2025-09-15T06:04:58.615153989Z
FJP,First Trust Japan AlphaDEX Fund,stocks,us,XNAS,ETF,True,usd,0001510337,2025-09-15T06:04:58.615154199Z
