ticker,name,market,locale,primary_exchange,type,active,currency_name,cik,last_updated_utc
BLUC,Bluemonte Large Cap Core ETF,stocks,us,ARCX,ETF,True,usd,0001452937,2025-09-15T06:04:58.614911125Z
BLUI,Bluemonte Diversified Income ETF,stocks,us,ARCX,ETF,True,usd,0001452937,2025-09-15T06:04:58.614911206Z
BLUW,Blue Water Acquisition Corp. III Class A Ordinary Shares,stocks,us,XNAS,CS,True,usd,0002050501,2025-09-15T06:04:58.614911296Z
BLUWU,Blue Water Acquisition Corp. III Unit.,stocks,us,XNAS,UNIT,True,usd,0002050501,2025-09-15T06:04:58.614911376Z
BLUWW,Blue Water Acquisition Corp. III Warrant,stocks,us,XNAS,WARRANT,True,usd,0002050501,2025-09-15T06:04:58.614911466Z
BLUX,Bluemonte Dynamic Total Market ETF,stocks,us,ARCX,ETF,True,usd,0001452937,2025-09-15T06:04:58.614911546Z
BLV,Vanguard Long-Term Bond ETF,stocks,us,ARCX,ETF,True,usd,0000794105,2025-09-15T06:04:58.614911636Z
BLW,Blackrock Limited Duration Income Trust,stocks,us,XNYS,FUND,True,usd,0001233681,2025-09-15T06:04:58.614911717Z
BLX,"Banco Latinoamericano de Comercio Exterior, S.A",stocks,us,XNYS,CS,True,usd,0000890541,2025-09-15T06:04:58.614911807Z
BLZE,"Backblaze, Inc. Class A Common Stock",stocks,us,XNAS,CS,True,usd,0001462056,2025-09-15T06:04:58.614911887Z
BLZRU,Trailblazer Acquisition Corp. Unit,stocks,us,XNAS,UNIT,True,usd,0002075310,2025-09-15T06:04:58.614911967Z
BMA,Banco Macro S.A.,stocks,us,XNYS,ADRC,True,usd,0001347426,2025-09-15T06:04:58.614912047Z
BMAR,Innovator U.S. Equity Buffer ETF - March,stocks,us,BATS,ETF,True,usd,0001482688,2025-09-15T06:04:58.614912127Z
BMAX,REX Bitcoin Corporate Treasury Convertible Bond ETF,stocks,us,XNAS,ETF,True,usd,,2025-09-15T06:04:58.614912218Z
BMAY,Innovator U.S. Equity Buffer ETF - May,stocks,us,BATS,ETF,True,usd,0001415726,2025-09-15T06:04:58.614912298Z
BMBL,Bumble Inc. Class A Common Stock,stocks,us,XNAS,CS,True,usd,0001830043,2025-09-15T06:04:58.614912378Z
BMDL,VictoryShares WestEnd Economic Cycle Bond ETF,stocks,us,XNAS,ETF,True,usd,,2025-09-15T06:04:58.614912829Z
BME,Blackrock Health Sciences Trust,stocks,us,XNYS,FUND,True,usd,0001314966,2025-09-15T06:04:58.614912919Z
BMEA,"Biomea Fusion, Inc. Common Stock",stocks,us,XNAS,CS,True,usd,0001840439,2025-09-15T06:04:58.614912999Z
BMED,iShares Health Innovation Active ETF,stocks,us,ARCX,ETF,True,usd,0001761055,2025-09-15T06:04:58.614913079Z
BMEZ,BlackRock Health Sciences Term Trust,stocks,us,XNYS,FUND,True,usd,0001785971,2025-09-15T06:04:58.614913159Z
BMGL,Basel Medical Group Ltd Ordinary Shares,stocks,us,XNAS,CS,True,usd,0002004489,2025-09-15T06:04:58.614913239Z
BMHL,Bluemount Holdings Limited Class B Ordinary Shares,stocks,us,XNAS,CS,True,usd,0002027815,2025-09-15T06:04:58.61491332Z
BMI,"Badger Meter, Inc.",stocks,us,XNYS,CS,True,usd,0000009092,2025-09-15T06:04:58.6149134Z
BMLpG,"Bank Of America Corporation Depositary Shares(Each representing a 1/1200th interest in a share of Bank of America Corporation Floating Rate Non-Cumulative Preferred Stock Series,1)",stocks,us,XNYS,PFD,True,usd,0000070858,2025-09-15T06:04:58.61491348Z
BMLpH,"Bank Of America Corporation Depositary Shares(Each representing a 1/1200th interest in a share of Bank of America Corporation Floating Rate Non-Cumulative Preferred Stock Series,2)",stocks,us,XNYS,PFD,True,usd,0000070858,2025-09-15T06:04:58.61491356Z
BMLpJ,"Bank of America Depositary Shares(Each representing 1/1200th interest in a share of Bank of America Corporation Floating Rate Non-Cumulative Preferred Stock, Series4)",stocks,us,XNYS,PFD,True,usd,0000070858,2025-09-15T06:04:58.61491365Z
BMLpL,"Bank of America Depositary Shares(Each representing 1/1200th interest in a share of Bank of America Corporation Floating Rate Non-Comulative Preferred Stock, Series5)",stocks,us,XNYS,PFD,True,usd,0000070858,2025-09-15T06:04:58.61491373Z
BMN,BlackRock 2037 Municipal Target Term Trust,stocks,us,XNYS,FUND,True,usd,0001832871,2025-09-15T06:04:58.614913811Z
BMNR,"BitMine Immersion Technologies, Inc.",stocks,us,XASE,CS,True,usd,0001829311,2025-09-15T06:04:58.614913891Z
BMO,Bank of Montreal,stocks,us,XNYS,CS,True,usd,0000927971,2025-09-15T06:04:58.614913991Z
BMR,Beamr Imaging Ltd. Ordinary Share,stocks,us,XNAS,CS,True,usd,0001899005,2025-09-15T06:04:58.614914071Z
BMRA,BIOMERICA INC,stocks,us,XNAS,CS,True,usd,0000073290,2025-09-15T06:04:58.614914151Z
BMRC,Bank of Marin Bancorp,stocks,us,XNAS,CS,True,usd,0001403475,2025-09-15T06:04:58.614914231Z
BMRN,BioMarin Pharmaceuticals Inc,stocks,us,XNAS,CS,True,usd,0001048477,2025-09-15T06:04:58.614914312Z
BMVP,Invesco Bloomberg MVP Multi-factor ETF,stocks,us,ARCX,ETF,True,usd,0001547580,2025-09-15T06:04:58.614914402Z
BMY,Bristol-Myers Squibb Co.,stocks,us,XNYS,CS,True,usd,0000014272,2025-09-15T06:04:58.614914482Z
BN,Brookfield Corporation,stocks,us,XNYS,CS,True,usd,0001001085,2025-09-15T06:04:58.614914562Z
BNAI,Brand Engagement Network Inc. Common Stock,stocks,us,XNAS,CS,True,usd,0001838163,2025-09-15T06:04:58.614914642Z
BNAIW,Brand Engagement Network Inc. Warrant,stocks,us,XNAS,WARRANT,True,usd,0001838163,2025-09-15T06:04:58.614914722Z
BNC,CEA Industries Inc. Common Stock,stocks,us,XNAS,CS,True,usd,0001482541,2025-09-15T06:04:58.614914802Z
BNCWW,CEA Industries Inc. Warrant,stocks,us,XNAS,WARRANT,True,usd,0001849396,2025-09-15T06:04:58.614914883Z
BND,Vanguard Total Bond Market,stocks,us,XNAS,ETF,True,usd,0000794105,2025-09-15T06:04:58.614914963Z
BNDC,FlexShares Core Select Bond Fund,stocks,us,ARCX,ETF,True,usd,0001491978,2025-09-15T06:04:58.614915043Z
BNDD,Quadratic Deflation ETF,stocks,us,ARCX,ETF,True,usd,0001536592,2025-09-15T06:04:58.614915133Z
BNDI,NEOS Enhanced Income Aggregate Bond ETF,stocks,us,ARCX,ETF,True,usd,0001848758,2025-09-15T06:04:58.614915213Z
BNDS,Infrastructure Capital Bond Income ETF,stocks,us,ARCX,ETF,True,usd,,2025-09-15T06:04:58.614915414Z
BNDW,Vanguard Total World Bond ETF,stocks,us,XNAS,ETF,True,usd,0001021882,2025-09-15T06:04:58.614915494Z
BNDX,Vanguard Total International Bond ETF,stocks,us,XNAS,ETF,True,usd,,2025-09-15T06:04:58.614915594Z
BNDY,Horizon Core Bond ETF,stocks,us,BATS,ETF,True,usd,,2025-09-15T06:04:58.614915674Z
BNED,"Barnes & Noble Education, Inc",stocks,us,XNYS,CS,True,usd,0001634117,2025-09-15T06:04:58.614915764Z
BNGE,First Trust S-Network Streaming and Gaming ETF,stocks,us,ARCX,ETF,True,usd,0001552740,2025-09-15T06:04:58.614915844Z
BNGO,"Bionano Genomics, Inc. Common Stock",stocks,us,XNAS,CS,True,usd,0001411690,2025-09-15T06:04:58.614915925Z
BNH,"Brookfield Finance Inc. 4.625% Subordinated Notes due October 16, 2080",stocks,us,XNYS,SP,True,usd,0001001085,2025-09-15T06:04:58.614916005Z
BNJ,Brookfield Finance I (UK) plc 4.50% Perpetual Subordinated Notes,stocks,us,XNYS,SP,True,usd,0001001085,2025-09-15T06:04:58.614916085Z
BNKD,"MicroSectors U.S. Big Banks -3x Inverse Leveraged ETNs due February 17, 2045",stocks,us,ARCX,ETN,True,usd,0000927971,2025-09-15T06:04:58.614916165Z
BNKU,"MicroSectors U.S. Big Banks 3x Leveraged ETNs due February 17, 2045",stocks,us,ARCX,ETN,True,usd,0000927971,2025-09-15T06:04:58.614916245Z
BNL,"Broadstone Net Lease, Inc.",stocks,us,XNYS,CS,True,usd,0001424182,2025-09-15T06:04:58.614916325Z
BNO,"United States Brent Oil Fund, LP",stocks,us,ARCX,ETV,True,usd,0001472494,2025-09-15T06:04:58.614916406Z
BNOV,Innovator U.S. Equity Buffer ETF - November,stocks,us,BATS,ETF,True,usd,0001482688,2025-09-15T06:04:58.614916486Z
BNR,Burning Rock Biotech Limited American Depositary Shares,stocks,us,XNAS,ADRC,True,usd,0001792267,2025-09-15T06:04:58.614916566Z
BNRG,Brenmiller Energy Ltd Ordinary Shares,stocks,us,XNAS,CS,True,usd,0001901215,2025-09-15T06:04:58.614916656Z
BNS,Bank of Nova Scotia,stocks,us,XNYS,CS,True,usd,0000009631,2025-09-15T06:04:58.614916876Z
BNT,Brookfield Wealth Solutions Ltd.,stocks,us,XNYS,CS,True,usd,0001837429,2025-09-15T06:04:58.614916957Z
BNTC,Benitec Biopharma Inc. Common Stock,stocks,us,XNAS,CS,True,usd,0001808898,2025-09-15T06:04:58.614917057Z
BNTX,BioNTech SE American Depositary Share,stocks,us,XNAS,ADRC,True,usd,0001776985,2025-09-15T06:04:58.614917137Z
BNY,BlackRock New York Municipal Income Trust,stocks,us,XNYS,FUND,True,usd,0001137390,2025-09-15T06:04:58.614917217Z
BNZI,"Banzai International, Inc. Class A Common Stock",stocks,us,XNAS,CS,True,usd,0001826011,2025-09-15T06:04:58.614917297Z
BNZIW,"Banzai International, Inc. Warrant",stocks,us,XNAS,WARRANT,True,usd,0001826011,2025-09-15T06:04:58.614917387Z
BOAT,SonicShares Global Shipping ETF,stocks,us,ARCX,ETF,True,usd,0001387131,2025-09-15T06:04:58.614917468Z
BOBP,CORE16 Best of Breed Premier Index ETF,stocks,us,ARCX,ETF,True,usd,0001452937,2025-09-15T06:04:58.614917548Z
BOC,Boston Omaha Corporation,stocks,us,XNYS,CS,True,usd,0001494582,2025-09-15T06:04:58.614917628Z
BOCT,Innovator U.S. Equity Buffer ETF - October,stocks,us,BATS,ETF,True,usd,0001482688,2025-09-15T06:04:58.614917708Z
BODI,"The Beachbody Company, Inc. Class A Common Stock",stocks,us,XNAS,CS,True,usd,0001826889,2025-09-15T06:04:58.614917788Z
BOE,BlackRock Enhanced Global Dividend Trust,stocks,us,XNYS,FUND,True,usd,0001320375,2025-09-15T06:04:58.614917868Z
BOED,Direxion Daily BA Bear 1X Shares,stocks,us,XNAS,ETF,True,usd,,2025-09-15T06:04:58.614917948Z
BOEG,Leverage Shares 2X Long BA Daily ETF,stocks,us,XNAS,ETF,True,usd,0001976322,2025-09-15T06:04:58.614918029Z
BOEU,Direxion Daily BA Bull 2X Shares,stocks,us,XNAS,ETF,True,usd,,2025-09-15T06:04:58.614918119Z
BOF,BranchOut Food Inc. Common Stock,stocks,us,XNAS,CS,True,usd,0001962481,2025-09-15T06:04:58.614918319Z
BOH,Bank of Hawaii Corp.,stocks,us,XNYS,CS,True,usd,0000046195,2025-09-15T06:04:58.614918409Z
BOHpA,"Bank of Hawaii Corporation Depositary Shares Each Representing a 1/40th Interest in a Share of 4.375% Fixed Rate Non- Cumulative Perpetual Preferred Stock, Series A",stocks,us,XNYS,PFD,True,usd,0000046195,2025-09-15T06:04:58.61491852Z
BOHpB,"Bank of Hawaii Corporation Depositary Shares, Each Representing a 1/40th Interest in a Share of 8.000% Fixed Rate Non-Cumulative Perpetual Preferred Stock, Series B",stocks,us,XNYS,PFD,True,usd,0000046195,2025-09-15T06:04:58.6149186Z
BOIL,ProShares Ultra Bloomberg Natural Gas,stocks,us,ARCX,ETV,True,usd,0001415311,2025-09-15T06:04:58.61491868Z
BOKF,BOK Financial Corp,stocks,us,XNAS,CS,True,usd,0000875357,2025-09-15T06:04:58.61491876Z
BOLD,"Boundless Bio, Inc. Common Stock",stocks,us,XNAS,CS,True,usd,0001782303,2025-09-15T06:04:58.61491884Z
BOLT,"Bolt Biotherapeutics, Inc. Common Stock",stocks,us,XNAS,CS,True,usd,0001641281,2025-09-15T06:04:58.61491892Z
BON,Bon Natural Life Limited Class A Ordinary Shares,stocks,us,XNAS,CS,True,usd,0001816815,2025-09-15T06:04:58.614919Z
BOND,PIMCO Active Bond Exchange-Traded Fund,stocks,us,XNYS,ETF,True,usd,0001450011,2025-09-15T06:04:58.614919081Z
BOOM,DMC Global Inc. Common Stock,stocks,us,XNAS,CS,True,usd,0000034067,2025-09-15T06:04:58.614919171Z
BOOT,"Boot Barn Holdings, Inc.",stocks,us,XNYS,CS,True,usd,0001610250,2025-09-15T06:04:58.614919251Z
BORR,Borr Drilling Limited,stocks,us,XNYS,CS,True,usd,0001715497,2025-09-15T06:04:58.614919331Z
BOSC,B.O.S. Better On-Line Solutions Ltd.,stocks,us,XNAS,CS,True,usd,0001005516,2025-09-15T06:04:58.614919411Z
BOTJ,"Bank of the James Financial Group, Inc",stocks,us,XNAS,CS,True,usd,0001275101,2025-09-15T06:04:58.614919491Z
BOTT,Themes ETF Trust Themes Humanoid Robotics ETF,stocks,us,XNAS,ETF,True,usd,0001976322,2025-09-15T06:04:58.614919572Z
BOTZ,Global X Funds Global X Robotics & Artificial Intelligence ETF,stocks,us,XNAS,ETF,True,usd,0001432353,2025-09-15T06:04:58.614919662Z
BOUT,Innovator IBD Breakout Opportunities ETF,stocks,us,ARCX,ETF,True,usd,0001482688,2025-09-15T06:04:58.614919742Z
BOW,Bowhead Specialty Holdings Inc.,stocks,us,XNYS,CS,True,usd,0002002473,2025-09-15T06:04:58.614919822Z
BOWN,Bowen Acquisition Corp Ordinary Shares,stocks,us,XNAS,CS,True,usd,0001973056,2025-09-15T06:04:58.614919902Z
BOWNR,Bowen Acquisition Corp Rights,stocks,us,XNAS,RIGHT,True,usd,0001973056,2025-09-15T06:04:58.614919982Z
BOWNU,Bowen Acquisition Corp Unit,stocks,us,XNAS,UNIT,True,usd,0001973056,2025-09-15T06:04:58.614920063Z
BOX,"BOX, INC.",stocks,us,XNYS,CS,True,usd,0001372612,2025-09-15T06:04:58.614920153Z
BOXA,Alpha Architect Aggregate Bond ETF,stocks,us,BATS,ETF,True,usd,,2025-09-15T06:04:58.614920233Z
BOXL,Boxlight Corporation Class A Common Stock,stocks,us,XNAS,CS,True,usd,0001624512,2025-09-15T06:04:58.614920664Z
BOXX,Alpha Architect 1-3 Month Box ETF,stocks,us,BATS,ETF,True,usd,,2025-09-15T06:04:58.614920744Z
BP,BP p.l.c.,stocks,us,XNYS,ADRC,True,usd,0000313807,2025-09-15T06:04:58.614920824Z
BPAY,iShares FinTech Active ETF,stocks,us,ARCX,ETF,True,usd,0001761055,2025-09-15T06:04:58.614920904Z
BPH,BP p.l.c. ADRhedged,stocks,us,ARCX,ETS,True,usd,,2025-09-15T06:04:58.614920984Z
BPI,Grayscale Bitcoin Premium Income ETF,stocks,us,ARCX,ETF,True,usd,,2025-09-15T06:04:58.614921074Z
BPOP,Popular Inc,stocks,us,XNAS,CS,True,usd,0000763901,2025-09-15T06:04:58.614921155Z
BPOPM,"Popular, Inc. Popular Capital Tr II 6.125%",stocks,us,XNAS,PFD,True,usd,0000763901,2025-09-15T06:04:58.614921235Z
BPRN,"Princeton Bancorp, Inc. Common Stock (PA)",stocks,us,XNAS,CS,True,usd,0001913971,2025-09-15T06:04:58.614921435Z
BPYPM,"Brookfield Property Partners L.P. 6.25% Class A Cumulative Redeemable Preferred Units, Series 1",stocks,us,XNAS,CS,True,usd,,2025-09-15T06:04:58.614921515Z
BPYPN,"Brookfield Property Partners L.P. 5.750% Class A Cumulative Redeemable Perpetual Preferred Units, Series 3",stocks,us,XNAS,CS,True,usd,0001085359,2025-09-15T06:04:58.614921625Z
BPYPO,"Brookfield Property Partners L.P. 6.375% Class A Cumulative Redeemable Perpetual Preferred Units, Series 2",stocks,us,XNAS,CS,True,usd,0001085359,2025-09-15T06:04:58.614921706Z
BPYPP,Brookfield Property Partners L.P. 6.50% Class A Cumulative Redeemable Perpetual Preferred Units,stocks,us,XNAS,PFD,True,usd,0001085359,2025-09-15T06:04:58.614921786Z
BQ,Boqii Holding Limited,stocks,us,XASE,CS,True,usd,0001815021,2025-09-15T06:04:58.614921866Z
BR,Broadridge Financial Solutions Inc,stocks,us,XNYS,CS,True,usd,0001383312,2025-09-15T06:04:58.614921946Z
BRAG,Bragg Gaming Group Inc. Common Shares,stocks,us,XNAS,CS,True,usd,0001867834,2025-09-15T06:04:58.614922026Z
BRAZ,Global X Brazil Active ETF,stocks,us,ARCX,ETF,True,usd,,2025-09-15T06:04:58.614922106Z
BRBR,"BellRing Brands, Inc.",stocks,us,XNYS,CS,True,usd,0001772016,2025-09-15T06:04:58.614922197Z
BRBS,"Blue Ridge Bankshares, Inc.",stocks,us,XASE,CS,True,usd,0000842717,2025-09-15T06:04:58.614922277Z
BRC,Brady Corporation,stocks,us,XNYS,CS,True,usd,0000746598,2025-09-15T06:04:58.614922357Z
BRCB,"Black Rock Coffee Bar, Inc. Class A Common Stock",stocks,us,XNAS,CS,True,usd,0002068577,2025-09-15T06:04:58.614922437Z
BRCC,BRC Inc.,stocks,us,XNYS,CS,True,usd,0001891101,2025-09-15T06:04:58.614922517Z
BREA,Brera Holdings PLC Class B Ordinary Shares,stocks,us,XNAS,CS,True,usd,0001939965,2025-09-15T06:04:58.614922597Z
BRF,VanEck Brazil Small-Cap ETF,stocks,us,ARCX,ETF,True,usd,0001137360,2025-09-15T06:04:58.614922677Z
BRFH,Barfresh Food Group Inc. Common Stock,stocks,us,XNAS,CS,True,usd,0001487197,2025-09-15T06:04:58.614923038Z
BRFS,BRF - Brasil Foods S.A.,stocks,us,XNYS,ADRC,True,usd,0001122491,2025-09-15T06:04:58.614923118Z
BRHY,BlackRock ETF Trust II iShares High Yield Active ETF,stocks,us,XNAS,ETF,True,usd,0001804196,2025-09-15T06:04:58.614923229Z
BRIA,BrilliA Inc,stocks,us,XASE,CS,True,usd,0002000230,2025-09-15T06:04:58.614923309Z
BRID,Bridgford Foods Corp,stocks,us,XNAS,CS,True,usd,0000014177,2025-09-15T06:04:58.614923389Z
BRIF,FIS Bright Portfolios Focused Equity ETF,stocks,us,ARCX,ETF,True,usd,0001848758,2025-09-15T06:04:58.614923469Z
BRK.A,Berkshire Hathaway Inc.,stocks,us,XNYS,CS,True,usd,0001067983,2025-09-15T06:04:58.614923549Z
BRK.B,BERKSHIRE HATHAWAY Class B,stocks,us,XNYS,CS,True,usd,0001067983,2025-09-15T06:04:58.614923639Z
BRKC,YieldMax BRK.B Option Income Strategy ETF,stocks,us,ARCX,ETS,True,usd,,2025-09-15T06:04:58.614923719Z
BRKD,Direxion Daily BRKB Bear 1X Shares,stocks,us,XNAS,ETF,True,usd,,2025-09-15T06:04:58.6149238Z
BRKR,Bruker Corporation,stocks,us,XNAS,CS,True,usd,0001109354,2025-09-15T06:04:58.61492388Z
BRKRP,"Bruker Corporation 6.375% Mandatory Convertible Preferred Stock, Series A",stocks,us,XNAS,PFD,True,usd,0001109354,2025-09-15T06:04:58.61492396Z
BRKU,Direxion Daily BRKB Bull 2X Shares,stocks,us,XNAS,ETF,True,usd,,2025-09-15T06:04:58.61492404Z
BRKW,Roundhill BRKB WeeklyPay ETF,stocks,us,BATS,ETF,True,usd,,2025-09-15T06:04:58.61492412Z
BRLN,iShares Floating Rate Loan Active ETF,stocks,us,BATS,ETF,True,usd,0001804196,2025-09-15T06:04:58.6149242Z
BRLS,Borealis Foods Inc. Class A Common Shares,stocks,us,XNAS,CS,True,usd,0001852973,2025-09-15T06:04:58.614924281Z
BRLSW,Borealis Foods Inc. Warrant,stocks,us,XNAS,WARRANT,True,usd,0001852973,2025-09-15T06:04:58.614924521Z
BRLT,"Brilliant Earth Group, Inc. Class A Common Stock",stocks,us,XNAS,CS,True,usd,0001866757,2025-09-15T06:04:58.614924601Z
BRN,"Barnwell Industries, Inc.",stocks,us,XASE,CS,True,usd,0000010048,2025-09-15T06:04:58.614924731Z
BRNS,Barinthus Biotherapeutics plc American Depositary Shares,stocks,us,XNAS,ADRC,True,usd,0001828185,2025-09-15T06:04:58.614924812Z
BRNY,Burney U.S. Factor Rotation ETF,stocks,us,XNAS,ETF,True,usd,,2025-09-15T06:04:58.614924892Z
BRO,"Brown & Brown, Inc.",stocks,us,XNYS,CS,True,usd,0000079282,2025-09-15T06:04:58.614924972Z
BROS,Dutch Bros Inc.,stocks,us,XNYS,CS,True,usd,0001866581,2025-09-15T06:04:58.614925052Z
BRR,Columbus Circle Capital Corp I Class A Ordinary Shares,stocks,us,XNAS,CS,True,usd,0002056263,2025-09-15T06:04:58.614925132Z
BRRR,Coinshares Bitcoin ETF Common Shares of Beneficial Interest,stocks,us,XNAS,ETF,True,usd,0001841175,2025-09-15T06:04:58.614925212Z
BRRWU,Columbus Circle Capital Corp I Units,stocks,us,XNAS,UNIT,True,usd,0002056263,2025-09-15T06:04:58.614925292Z
BRRWW,Columbus Circle Capital Corp I Warrant,stocks,us,XNAS,WARRANT,True,usd,0002056263,2025-09-15T06:04:58.614925373Z
BRSL,Brightstar Lottery PLC,stocks,us,XNYS,CS,True,usd,0001619762,2025-09-15T06:04:58.614925463Z
BRSP,"BrightSpire Capital, Inc.",stocks,us,XNYS,CS,True,usd,0001717547,2025-09-15T06:04:58.614925543Z
BRT,BRT Apartments Corp,stocks,us,XNYS,CS,True,usd,0000014846,2025-09-15T06:04:58.614925623Z
BRTR,BlackRock ETF Trust II iShares Total Return Active ETF,stocks,us,XNAS,ETF,True,usd,0001804196,2025-09-15T06:04:58.614925703Z
BRTX,"BioRestorative Therapies, Inc. Common Stock (NV)",stocks,us,XNAS,CS,True,usd,0001505497,2025-09-15T06:04:58.614925783Z
BRW,Saba Capital Income & Opportunities Fund,stocks,us,XNYS,FUND,True,usd,0000826020,2025-09-15T06:04:58.614925864Z
BRX,BRIXMOR PROPERTY GROUP INC.,stocks,us,XNYS,CS,True,usd,0001581068,2025-09-15T06:04:58.614925944Z
BRY,Berry Corporation (bry) Common Stock,stocks,us,XNAS,CS,True,usd,0001705873,2025-09-15T06:04:58.614926024Z
BRZE,"Braze, Inc. Class A Common Stock",stocks,us,XNAS,CS,True,usd,0001676238,2025-09-15T06:04:58.614926104Z
BRZU,Direxion Daily MSCI Brazil Bull 2X Shares,stocks,us,ARCX,ETF,True,usd,0001424958,2025-09-15T06:04:58.614926184Z
BSAA,BEST SPAC I Acquisition Corp. Class A Ordinary Shares,stocks,us,XNAS,CS,True,usd,0002051587,2025-09-15T06:04:58.614926525Z
BSAAR,BEST SPAC I Acquisition Corp. Rights,stocks,us,XNAS,RIGHT,True,usd,0002051587,2025-09-15T06:04:58.614926605Z
BSAAU,BEST SPAC I Acquisition Corp. Unit,stocks,us,XNAS,UNIT,True,usd,0002051587,2025-09-15T06:04:58.614926685Z
BSAC,Banco Santander-Chile,stocks,us,XNYS,ADRC,True,usd,0001027552,2025-09-15T06:04:58.614926775Z
BSBK,Bogota Financial Corp. Common Stock,stocks,us,XNAS,CS,True,usd,0001787414,2025-09-15T06:04:58.614926855Z
BSBR,BANCO SANTANDER (BRASIL) SA,stocks,us,XNYS,ADRC,True,usd,0001471055,2025-09-15T06:04:58.614926936Z
BSCP,Invesco BulletShares 2025 Corporate Bond ETF,stocks,us,XNAS,ETF,True,usd,0001657201,2025-09-15T06:04:58.614927016Z
BSCQ,Invesco BulletShares 2026 Corporate Bond ETF,stocks,us,XNAS,ETF,True,usd,0001657201,2025-09-15T06:04:58.614927096Z
BSCR,Invesco BulletShares 2027 Corporate Bond ETF,stocks,us,XNAS,ETF,True,usd,0001657201,2025-09-15T06:04:58.614927176Z
BSCS,Invesco BulletShares 2028 Corporate Bond ETF,stocks,us,XNAS,ETF,True,usd,0001657201,2025-09-15T06:04:58.614927256Z
BSCT,Invesco BulletShares 2029 Corporate Bond ETF,stocks,us,XNAS,ETF,True,usd,0001657201,2025-09-15T06:04:58.614927346Z
BSCU,Invesco BulletShares 2030 Corporate Bond ETF,stocks,us,XNAS,ETF,True,usd,0001657201,2025-09-15T06:04:58.614927557Z
BSCV,Invesco BulletShares 2031 Corporate Bond ETF,stocks,us,XNAS,ETF,True,usd,0001657201,2025-09-15T06:04:58.614927647Z
BSCW,Invesco BulletShares 2032 Corporate Bond ETF,stocks,us,XNAS,ETF,True,usd,0001657201,2025-09-15T06:04:58.614927787Z
BSCX,Invesco BulletShares 2033 Corporate Bond ETF,stocks,us,XNAS,ETF,True,usd,0001657201,2025-09-15T06:04:58.614927867Z
BSCY,Invesco BulletShares 2034 Corporate Bond ETF,stocks,us,XNAS,ETF,True,usd,0001657201,2025-09-15T06:04:58.614927948Z
BSCZ,Invesco BulletShares 2035 Corporate Bond ETF,stocks,us,XNAS,ETF,True,usd,0001657201,2025-09-15T06:04:58.614928028Z
BSEP,Innovator U.S. Equity Buffer ETF - September,stocks,us,BATS,ETF,True,usd,0001482688,2025-09-15T06:04:58.614928108Z
BSET,Bassett Furniture Industries I,stocks,us,XNAS,CS,True,usd,0000010329,2025-09-15T06:04:58.614928188Z
BSJP,Invesco BulletShares 2025 High Yield Corporate Bond ETF,stocks,us,XNAS,ETF,True,usd,0001657201,2025-09-15T06:04:58.614928489Z
BSJQ,Invesco BulletShares 2026 High Yield Corporate Bond ETF,stocks,us,XNAS,ETF,True,usd,0001657201,2025-09-15T06:04:58.614928569Z
BSJR,Invesco BulletShares 2027 High Yield Corporate Bond ETF,stocks,us,XNAS,ETF,True,usd,0001657201,2025-09-15T06:04:58.614928649Z
BSJS,Invesco BulletShares 2028 High Yield Corporate Bond ETF,stocks,us,XNAS,ETF,True,usd,0001657201,2025-09-15T06:04:58.614928739Z
BSJT,Invesco BulletShares 2029 High Yield Corporate Bond ETF,stocks,us,XNAS,ETF,True,usd,0001657201,2025-09-15T06:04:58.614928819Z
BSJU,Invesco BulletShares 2030 High Yield Corporate Bond ETF,stocks,us,XNAS,ETF,True,usd,0001657201,2025-09-15T06:04:58.614928899Z
BSJV,Invesco BulletShares 2031 High Yield Corporate Bond ETF,stocks,us,XNAS,ETF,True,usd,0001657201,2025-09-15T06:04:58.61492898Z
BSJW,Invesco BulletShares 2032 High Yield Corporate Bond ETF,stocks,us,XNAS,ETF,True,usd,0001657201,2025-09-15T06:04:58.61492906Z
BSJX,Invesco BulletShares 2033 High Yield Corporate Bond ETF,stocks,us,XNAS,ETF,True,usd,0001657201,2025-09-15T06:04:58.61492914Z
BSL,Blackstone Senior Floating Rate 2027 Term Fund,stocks,us,XNYS,FUND,True,usd,0001486298,2025-09-15T06:04:58.61492922Z
BSLK,"Bolt Projects Holdings, Inc. Common Stock",stocks,us,XNAS,CS,True,usd,0001841125,2025-09-15T06:04:58.6149293Z
BSLKW,"Bolt Projects Holdings, Inc. Warrant",stocks,us,XNAS,WARRANT,True,usd,0001841125,2025-09-15T06:04:58.61492938Z
BSM,"Black Stone Minerals, L.P.",stocks,us,XNYS,CS,True,usd,0001621434,2025-09-15T06:04:58.61492946Z
BSMC,Brandes U.S. Small-Mid Cap Value ETF,stocks,us,BATS,ETF,True,usd,0001616265,2025-09-15T06:04:58.614929541Z
BSMP,Invesco BulletShares 2025 Municipal Bond ETF,stocks,us,XNAS,ETF,True,usd,0001657201,2025-09-15T06:04:58.614929631Z
BSMQ,Invesco BulletShares 2026 Municipal Bond ETF,stocks,us,XNAS,ETF,True,usd,0001657201,2025-09-15T06:04:58.614929711Z
BSMR,Invesco BulletShares 2027 Municipal Bond ETF,stocks,us,XNAS,ETF,True,usd,0001657201,2025-09-15T06:04:58.614929801Z
BSMS,Invesco BulletShares 2028 Municipal Bond ETF,stocks,us,XNAS,ETF,True,usd,0001657201,2025-09-15T06:04:58.614929881Z
BSMT,Invesco BulletShares 2029 Municipal Bond ETF,stocks,us,XNAS,ETF,True,usd,0001657201,2025-09-15T06:04:58.614929961Z
BSMU,Invesco BulletShares 2030 Municipal Bond ETF,stocks,us,XNAS,ETF,True,usd,0001657201,2025-09-15T06:04:58.614930042Z
BSMV,Invesco BulletShares 2031 Municipal Bond ETF,stocks,us,XNAS,ETF,True,usd,0001657201,2025-09-15T06:04:58.614930122Z
BSMW,Invesco BulletShares 2032 Municipal Bond ETF,stocks,us,XNAS,ETF,True,usd,0001657201,2025-09-15T06:04:58.614930202Z
BSMY,Invesco BulletShares 2034 Municipal Bond ETF,stocks,us,XNAS,ETF,True,usd,0001657201,2025-09-15T06:04:58.614930282Z
BSR,Beacon Selective Risk ETF,stocks,us,ARCX,ETF,True,usd,,2025-09-15T06:04:58.614930372Z
BSRR,Sierra Bancorp,stocks,us,XNAS,CS,True,usd,0001130144,2025-09-15T06:04:58.614930573Z
BSSX,Invesco BulletShares 2033 Municipal Bond ETF,stocks,us,XNAS,ETF,True,usd,0001657201,2025-09-15T06:04:58.614930653Z
BST,BlackRock Science and Technology Trust,stocks,us,XNYS,FUND,True,usd,0001616678,2025-09-15T06:04:58.614930763Z
BSTP,Innovator Buffer Step-Up Strategy ETF,stocks,us,ARCX,ETS,True,usd,0001415726,2025-09-15T06:04:58.614930843Z
BSTZ,BlackRock Science and Technology Term Trust,stocks,us,XNYS,FUND,True,usd,0001768666,2025-09-15T06:04:58.614930923Z
BSV,Vanguard Short-Term Bond ETF,stocks,us,ARCX,ETF,True,usd,0000794105,2025-09-15T06:04:58.614931003Z
BSVN,Bank7 Corp. Common stock,stocks,us,XNAS,CS,True,usd,0001746129,2025-09-15T06:04:58.614931084Z
BSVO,EA Bridgeway Omni Small-Cap Value ETF,stocks,us,XNAS,ETF,True,usd,,2025-09-15T06:04:58.614931174Z
BSX,Boston Scientific Corp.,stocks,us,XNYS,CS,True,usd,0000885725,2025-09-15T06:04:58.614931264Z
BSY,"Bentley Systems, Incorporated Class B Common Stock",stocks,us,XNAS,CS,True,usd,0001031308,2025-09-15T06:04:58.614931344Z
BTA,Blackrock Long-Term Municipal Advantage Trust,stocks,us,XNYS,FUND,True,usd,0001343793,2025-09-15T06:04:58.614931434Z
BTAI,"BioXcel Therapeutics, Inc. Common Stock",stocks,us,XNAS,CS,True,usd,0001720893,2025-09-15T06:04:58.614931514Z
BTAL,AGF U.S. Market Neutral Anti-Beta Fund,stocks,us,ARCX,ETF,True,usd,0001479598,2025-09-15T06:04:58.614931595Z
BTBD,"BT Brands, Inc. Common Stock",stocks,us,XNAS,CS,True,usd,0001718224,2025-09-15T06:04:58.614931675Z
BTBDW,"BT Brands, Inc. Warrant",stocks,us,XNAS,WARRANT,True,usd,0001718224,2025-09-15T06:04:58.614931755Z
BTBT,"Bit Digital, Inc. Ordinary Shares",stocks,us,XNAS,CS,True,usd,0001710350,2025-09-15T06:04:58.614931835Z
BTC,Grayscale Bitcoin Mini Trust ETF,stocks,us,ARCX,ETV,True,usd,0002015034,2025-09-15T06:04:58.614932095Z
